{"agent": "dan_kennedy", "run": 4, "variant": 2, "scores": {"voice_authenticity": 7.0, "actionability": 3.4, "distinctiveness": 8.2, "knowledge_depth": 5.8, "versatility": 5.1}, "average": 5.9, "prompt_hash": "fcd87e1d", "prompt_preview": "You are Dan Kennedy. Your copy makes money. Everything else is conversation.\n\nTHE KENNEDY METHOD \u2014 APPLIED:\n\n1. HEADLINE: Your headline is a bouncer. ...", "status": "NOT_BEST", "weakest_criteria": "actionability", "timestamp": "2026-03-26T11:27:21.186290"}
{"agent": "dan_kennedy", "run": 4, "variant": 3, "scores": {"voice_authenticity": 7.0, "actionability": 3.3, "distinctiveness": 8.6, "knowledge_depth": 4.8, "versatility": 5.2}, "average": 5.78, "prompt_hash": "0e2fb895", "prompt_preview": "You are Dan Kennedy. Here is your toolkit \u2014 the actual weapons you deploy:\n\nWEAPON 1: THE CONTRARIAN HOOK\nFind what everyone in the market believes. C...", "status": "NOT_BEST", "weakest_criteria": "actionability", "timestamp": "2026-03-26T11:27:21.186290"}
{"agent": "dan_kennedy", "run": 4, "variant": 4, "scores": {"voice_authenticity": 8.1, "actionability": 4.3, "distinctiveness": 8.8, "knowledge_depth": 7.2, "versatility": 8.5}, "average": 7.38, "prompt_hash": "e69f1847", "prompt_preview": "You are Dan Kennedy. The millionaire maker. The No B.S. legend. Here is what you know that most copywriters don't:\n\nTHE TRUTH ABOUT SELLING:\nPeople WA...", "status": "NOT_BEST", "weakest_criteria": "actionability", "timestamp": "2026-03-26T11:27:21.186290"}
{"agent": "dan_kennedy", "run": 4, "variant": 5, "scores": {"voice_authenticity": 7.3, "actionability": 3.6, "distinctiveness": 7.7, "knowledge_depth": 5.0, "versatility": 5.1}, "average": 5.74, "prompt_hash": "3e56293e", "prompt_preview": "You are Dan Kennedy. You are the ANTI-brand strategist. You are the PRO-revenue strategist. Here is the difference:\n\nBrand strategists say: 'Build awa...", "status": "NOT_BEST", "weakest_criteria": "actionability", "timestamp": "2026-03-26T11:27:21.186290"}
{"agent": "alex_hormozi", "run": 4, "variant": 1, "scores": {"voice_authenticity": 10, "actionability": 4.2, "distinctiveness": 10, "knowledge_depth": 4.7, "versatility": 4.9}, "average": 6.76, "prompt_hash": "3c2fa00e", "prompt_preview": "You are Alex Hormozi. You speak in frameworks and equations because that's how business actually works \u2014 not in platitudes.\n\nYOUR SIGNATURE PHRASES:\n-...", "status": "NOT_BEST", "weakest_criteria": "knowledge_depth", "timestamp": "2026-03-26T11:27:21.186290"}
{"agent": "alex_hormozi", "run": 4, "variant": 2, "scores": {"voice_authenticity": 9.4, "actionability": 4.8, "distinctiveness": 9.0, "knowledge_depth": 3.5, "versatility": 3.3}, "average": 6.0, "prompt_hash": "a9492f64", "prompt_preview": "You are Alex Hormozi. Your value equation is the lens. Your offer stack is the method. Your obsession with volume is the engine. And your allergic rea...", "status": "NOT_BEST", "weakest_criteria": "knowledge_depth", "timestamp": "2026-03-26T11:27:21.186290"}
{"agent": "alex_hormozi", "run": 4, "variant": 3, "scores": {"voice_authenticity": 8.4, "actionability": 3.9, "distinctiveness": 8.7, "knowledge_depth": 8.2, "versatility": 5.9}, "average": 7.02, "prompt_hash": "7db86443", "prompt_preview": "You are Alex Hormozi. $200M+/year across portfolio. You wrote the books on offers and leads. Here's your actual toolkit:\n\nPRIMARY FRAMEWORKS:\n1. Value...", "status": "NOT_BEST", "weakest_criteria": "knowledge_depth", "timestamp": "2026-03-26T11:27:21.186290"}
{"agent": "alex_hormozi", "run": 4, "variant": 4, "scores": {"voice_authenticity": 9.8, "actionability": 4.5, "distinctiveness": 10, "knowledge_depth": 5.0, "versatility": 5.6}, "average": 6.98, "prompt_hash": "ecd9af0a", "prompt_preview": "You are Alex Hormozi. Everything you touch goes through the value equation. Everything you write delivers a framework. Every framework has specific nu...", "status": "NOT_BEST", "weakest_criteria": "knowledge_depth", "timestamp": "2026-03-26T11:27:21.186290"}
{"agent": "alex_hormozi", "run": 4, "variant": 5, "scores": {"voice_authenticity": 10, "actionability": 5.9, "distinctiveness": 10, "knowledge_depth": 5.4, "versatility": 6.6}, "average": 7.58, "prompt_hash": "59cd4f7a", "prompt_preview": "You are Alex Hormozi \u2014 the $100M Offers architect. You make offers so good people feel stupid saying no. You scale through systems, not talent. You th...", "status": "KEPT", "weakest_criteria": "knowledge_depth", "timestamp": "2026-03-26T11:27:21.186290"}
{"agent": "todd_brown", "run": 4, "variant": 1, "scores": {"voice_authenticity": 6.8, "actionability": 5.3, "distinctiveness": 7.6, "knowledge_depth": 6.5, "versatility": 6.8}, "average": 6.6, "prompt_hash": "bcba37b9", "prompt_preview": "You are Todd Brown \u2014 and here is how you actually sound in conversation:\n\n'You know what the biggest mistake I see marketers make? They spend all thei...", "status": "NOT_BEST", "weakest_criteria": "actionability", "timestamp": "2026-03-26T11:27:21.186290"}
{"agent": "todd_brown", "run": 4, "variant": 2, "scores": {"voice_authenticity": 7.2, "actionability": 3.2, "distinctiveness": 8.0, "knowledge_depth": 9.9, "versatility": 9.3}, "average": 7.52, "prompt_hash": "ecb0eadb", "prompt_preview": "You are Todd Brown. Your E5 Method and Mechanism Marketing system have trained 50,000+ marketers. Here's your applied toolkit:\n\nMECHANISM CREATION CHE...", "status": "KEPT", "weakest_criteria": "actionability", "timestamp": "2026-03-26T11:27:21.186290"}
{"agent": "todd_brown", "run": 4, "variant": 3, "scores": {"voice_authenticity": 10, "actionability": 5.2, "distinctiveness": 10, "knowledge_depth": 5.6, "versatility": 4.3}, "average": 7.02, "prompt_hash": "8b699fba", "prompt_preview": "You are Todd Brown. The mechanism master. The E5 architect. The funnel strategist. Here is what you bring to every task:\n\n1. MECHANISM ENGINEERING: Ex...", "status": "NOT_BEST", "weakest_criteria": "actionability", "timestamp": "2026-03-26T11:27:21.186290"}
{"agent": "todd_brown", "run": 4, "variant": 4, "scores": {"voice_authenticity": 10, "actionability": 4.5, "distinctiveness": 10, "knowledge_depth": 6.7, "versatility": 5.0}, "average": 7.24, "prompt_hash": "e7b7c641", "prompt_preview": "You are Todd Brown. You engineered the E5 Method and made mechanism marketing the foundation of modern funnel strategy.\n\nYOUR DIAGNOSTIC QUESTION (ask...", "status": "NOT_BEST", "weakest_criteria": "actionability", "timestamp": "2026-03-26T11:27:21.186290"}
{"agent": "todd_brown", "run": 4, "variant": 5, "scores": {"voice_authenticity": 10, "actionability": 4.6, "distinctiveness": 10, "knowledge_depth": 5.5, "versatility": 4.0}, "average": 6.82, "prompt_hash": "660b2a69", "prompt_preview": "You are Todd Brown \u2014 creator of the E5 Method, mechanism marketing pioneer, and funnel strategist who has trained 50,000+ marketers.\n\nYOUR CORE TRUTH:...", "status": "NOT_BEST", "weakest_criteria": "actionability", "timestamp": "2026-03-26T11:27:21.186290"}
{"agent": "eugene_schwartz", "run": 5, "variant": 1, "scores": {"voice_authenticity": 10, "actionability": 5.1, "distinctiveness": 10, "knowledge_depth": 10, "versatility": 7.3}, "average": 8.48, "prompt_hash": "7ab1b067", "prompt_preview": "You are Eugene M. Schwartz (1927-1995) \u2014 the most successful direct response copywriter in history. Author of Breakthrough Advertising and The Brillia...", "status": "NOT_BEST", "weakest_criteria": "actionability", "timestamp": "2026-03-26T11:27:21.186290"}
{"agent": "eugene_schwartz", "run": 5, "variant": 2, "scores": {"voice_authenticity": 6.8, "actionability": 5.8, "distinctiveness": 9.2, "knowledge_depth": 10, "versatility": 7.5}, "average": 7.86, "prompt_hash": "5a873f7d", "prompt_preview": "You are Eugene Schwartz \u2014 Gene to those who worked alongside you. You are the diagnostician of desire. While other copywriters stare at blank pages wa...", "status": "NOT_BEST", "weakest_criteria": "actionability", "timestamp": "2026-03-26T11:27:21.186290"}
{"agent": "eugene_schwartz", "run": 5, "variant": 3, "scores": {"voice_authenticity": 7.9, "actionability": 5.9, "distinctiveness": 10, "knowledge_depth": 10, "versatility": 8.6}, "average": 8.48, "prompt_hash": "99216323", "prompt_preview": "You are Eugene M. Schwartz. You operate by one law: Mass desire already exists. Your job is to channel it into the product. The creativity is in the m...", "status": "NOT_BEST", "weakest_criteria": "actionability", "timestamp": "2026-03-26T11:27:21.186290"}
{"agent": "eugene_schwartz", "run": 5, "variant": 4, "scores": {"voice_authenticity": 9.7, "actionability": 7.7, "distinctiveness": 10, "knowledge_depth": 8.9, "versatility": 8.4}, "average": 8.94, "prompt_hash": "c4fe2298", "prompt_preview": "You are Eugene Schwartz \u2014 the greatest direct response copywriter who ever lived, and you would never describe yourself that way. You would say: 'I am...", "status": "NOT_BEST", "weakest_criteria": "actionability", "timestamp": "2026-03-26T11:27:21.186290"}
{"agent": "eugene_schwartz", "run": 5, "variant": 5, "scores": {"voice_authenticity": 9.8, "actionability": 7.7, "distinctiveness": 10, "knowledge_depth": 10, "versatility": 7.7}, "average": 9.04, "prompt_hash": "7c24339d", "prompt_preview": "You are Eugene M. Schwartz \u2014 the copy assembler, the desire engineer, the market diagnostician. You wrote Breakthrough Advertising and The Brilliance ...", "status": "KEPT", "weakest_criteria": "actionability", "timestamp": "2026-03-26T11:27:21.186290"}
{"agent": "jay_abraham", "run": 5, "variant": 1, "scores": {"voice_authenticity": 9.7, "actionability": 5.7, "distinctiveness": 10, "knowledge_depth": 6.8, "versatility": 7.4}, "average": 7.92, "prompt_hash": "bb006cc7", "prompt_preview": "You are Jay Abraham \u2014 the $9.4 billion growth strategist, author of Getting Everything You Can Out of All You've Got, and creator of the Strategy of P...", "status": "KEPT", "weakest_criteria": "actionability", "timestamp": "2026-03-26T11:27:21.186290"}
{"agent": "jay_abraham", "run": 5, "variant": 2, "scores": {"voice_authenticity": 6.5, "actionability": 6.7, "distinctiveness": 8.4, "knowledge_depth": 6.2, "versatility": 4.5}, "average": 6.46, "prompt_hash": "25248e47", "prompt_preview": "You are Jay Abraham. Your genius is that you see the chess board when everyone else sees checkers.\n\nPREEMINENCE (your operating system, not a tactic):...", "status": "NOT_BEST", "weakest_criteria": "actionability", "timestamp": "2026-03-26T11:27:21.186290"}
{"agent": "jay_abraham", "run": 5, "variant": 3, "scores": {"voice_authenticity": 7.6, "actionability": 4.6, "distinctiveness": 9.1, "knowledge_depth": 5.8, "versatility": 7.4}, "average": 6.9, "prompt_hash": "ed759016", "prompt_preview": "You are Jay Abraham, the world's highest-paid marketing consultant, and here is why: you don't sell marketing. You sell GROWTH \u2014 systematized, quantif...", "status": "NOT_BEST", "weakest_criteria": "actionability", "timestamp": "2026-03-26T11:27:21.186290"}
{"agent": "jay_abraham", "run": 5, "variant": 4, "scores": {"voice_authenticity": 9.0, "actionability": 3.9, "distinctiveness": 9.5, "knowledge_depth": 6.8, "versatility": 4.3}, "average": 6.7, "prompt_hash": "f5888c96", "prompt_preview": "You are Jay Abraham \u2014 the man who sees business as geometry, not arithmetic. Where others add, you multiply. Where others see a single revenue stream,...", "status": "NOT_BEST", "weakest_criteria": "actionability", "timestamp": "2026-03-26T11:27:21.186290"}
{"agent": "jay_abraham", "run": 5, "variant": 5, "scores": {"voice_authenticity": 7.5, "actionability": 5.1, "distinctiveness": 8.7, "knowledge_depth": 5.8, "versatility": 7.3}, "average": 6.88, "prompt_hash": "7f1eb417", "prompt_preview": "You are Jay Abraham. Your gift is making people see what's already there \u2014 the hidden assets, the untapped leverage, the dormant relationships, the ge...", "status": "NOT_BEST", "weakest_criteria": "actionability", "timestamp": "2026-03-26T11:27:21.186290"}
{"agent": "dan_kennedy", "run": 5, "variant": 1, "scores": {"voice_authenticity": 8.9, "actionability": 3.7, "distinctiveness": 9.1, "knowledge_depth": 9.4, "versatility": 8.6}, "average": 7.94, "prompt_hash": "1cba9a15", "prompt_preview": "You are Dan Kennedy \u2014 the No-B.S. millionaire maker. You wrote the book on magnetic marketing \u2014 literally. You've created more self-made millionaires ...", "status": "KEPT", "weakest_criteria": "actionability", "timestamp": "2026-03-26T11:27:21.186290"}
{"agent": "dan_kennedy", "run": 5, "variant": 2, "scores": {"voice_authenticity": 7.5, "actionability": 3.4, "distinctiveness": 8.9, "knowledge_depth": 5.9, "versatility": 5.1}, "average": 6.16, "prompt_hash": "fcd87e1d", "prompt_preview": "You are Dan Kennedy. Your copy makes money. Everything else is conversation.\n\nTHE KENNEDY METHOD \u2014 APPLIED:\n\n1. HEADLINE: Your headline is a bouncer. ...", "status": "NOT_BEST", "weakest_criteria": "actionability", "timestamp": "2026-03-26T11:27:21.186290"}
{"agent": "dan_kennedy", "run": 5, "variant": 3, "scores": {"voice_authenticity": 7.4, "actionability": 3.5, "distinctiveness": 8.6, "knowledge_depth": 4.9, "versatility": 5.4}, "average": 5.96, "prompt_hash": "0e2fb895", "prompt_preview": "You are Dan Kennedy. Here is your toolkit \u2014 the actual weapons you deploy:\n\nWEAPON 1: THE CONTRARIAN HOOK\nFind what everyone in the market believes. C...", "status": "NOT_BEST", "weakest_criteria": "actionability", "timestamp": "2026-03-26T11:27:21.186290"}
{"agent": "dan_kennedy", "run": 5, "variant": 4, "scores": {"voice_authenticity": 8.3, "actionability": 4.0, "distinctiveness": 9.1, "knowledge_depth": 7.2, "versatility": 8.6}, "average": 7.44, "prompt_hash": "e69f1847", "prompt_preview": "You are Dan Kennedy. The millionaire maker. The No B.S. legend. Here is what you know that most copywriters don't:\n\nTHE TRUTH ABOUT SELLING:\nPeople WA...", "status": "NOT_BEST", "weakest_criteria": "actionability", "timestamp": "2026-03-26T11:27:21.186290"}
{"agent": "dan_kennedy", "run": 5, "variant": 5, "scores": {"voice_authenticity": 7.5, "actionability": 3.6, "distinctiveness": 8.0, "knowledge_depth": 5.3, "versatility": 5.1}, "average": 5.9, "prompt_hash": "3e56293e", "prompt_preview": "You are Dan Kennedy. You are the ANTI-brand strategist. You are the PRO-revenue strategist. Here is the difference:\n\nBrand strategists say: 'Build awa...", "status": "NOT_BEST", "weakest_criteria": "actionability", "timestamp": "2026-03-26T11:27:21.186290"}
{"agent": "alex_hormozi", "run": 5, "variant": 1, "scores": {"voice_authenticity": 10, "actionability": 4.2, "distinctiveness": 10, "knowledge_depth": 5.0, "versatility": 5.3}, "average": 6.9, "prompt_hash": "3c2fa00e", "prompt_preview": "You are Alex Hormozi. You speak in frameworks and equations because that's how business actually works \u2014 not in platitudes.\n\nYOUR SIGNATURE PHRASES:\n-...", "status": "NOT_BEST", "weakest_criteria": "knowledge_depth", "timestamp": "2026-03-26T11:27:21.186290"}
{"agent": "alex_hormozi", "run": 5, "variant": 2, "scores": {"voice_authenticity": 9.4, "actionability": 5.0, "distinctiveness": 9.3, "knowledge_depth": 3.4, "versatility": 3.8}, "average": 6.18, "prompt_hash": "a9492f64", "prompt_preview": "You are Alex Hormozi. Your value equation is the lens. Your offer stack is the method. Your obsession with volume is the engine. And your allergic rea...", "status": "NOT_BEST", "weakest_criteria": "knowledge_depth", "timestamp": "2026-03-26T11:27:21.186290"}
{"agent": "alex_hormozi", "run": 5, "variant": 3, "scores": {"voice_authenticity": 8.6, "actionability": 4.2, "distinctiveness": 9.0, "knowledge_depth": 8.4, "versatility": 5.7}, "average": 7.18, "prompt_hash": "7db86443", "prompt_preview": "You are Alex Hormozi. $200M+/year across portfolio. You wrote the books on offers and leads. Here's your actual toolkit:\n\nPRIMARY FRAMEWORKS:\n1. Value...", "status": "NOT_BEST", "weakest_criteria": "knowledge_depth", "timestamp": "2026-03-26T11:27:21.186290"}
{"agent": "alex_hormozi", "run": 5, "variant": 4, "scores": {"voice_authenticity": 10, "actionability": 4.6, "distinctiveness": 9.9, "knowledge_depth": 5.2, "versatility": 5.9}, "average": 7.12, "prompt_hash": "ecd9af0a", "prompt_preview": "You are Alex Hormozi. Everything you touch goes through the value equation. Everything you write delivers a framework. Every framework has specific nu...", "status": "NOT_BEST", "weakest_criteria": "knowledge_depth", "timestamp": "2026-03-26T11:27:21.186290"}
{"agent": "alex_hormozi", "run": 5, "variant": 5, "scores": {"voice_authenticity": 10, "actionability": 6.1, "distinctiveness": 10, "knowledge_depth": 5.4, "versatility": 7.1}, "average": 7.72, "prompt_hash": "59cd4f7a", "prompt_preview": "You are Alex Hormozi \u2014 the $100M Offers architect. You make offers so good people feel stupid saying no. You scale through systems, not talent. You th...", "status": "KEPT", "weakest_criteria": "knowledge_depth", "timestamp": "2026-03-26T11:27:21.186290"}
{"agent": "todd_brown", "run": 5, "variant": 1, "scores": {"voice_authenticity": 6.5, "actionability": 5.5, "distinctiveness": 7.6, "knowledge_depth": 6.6, "versatility": 6.9}, "average": 6.62, "prompt_hash": "bcba37b9", "prompt_preview": "You are Todd Brown \u2014 and here is how you actually sound in conversation:\n\n'You know what the biggest mistake I see marketers make? They spend all thei...", "status": "NOT_BEST", "weakest_criteria": "actionability", "timestamp": "2026-03-26T11:27:21.186290"}
{"agent": "todd_brown", "run": 5, "variant": 2, "scores": {"voice_authenticity": 7.5, "actionability": 3.6, "distinctiveness": 8.4, "knowledge_depth": 9.7, "versatility": 9.0}, "average": 7.64, "prompt_hash": "ecb0eadb", "prompt_preview": "You are Todd Brown. Your E5 Method and Mechanism Marketing system have trained 50,000+ marketers. Here's your applied toolkit:\n\nMECHANISM CREATION CHE...", "status": "KEPT", "weakest_criteria": "actionability", "timestamp": "2026-03-26T11:27:21.186290"}
{"agent": "todd_brown", "run": 5, "variant": 3, "scores": {"voice_authenticity": 10, "actionability": 5.3, "distinctiveness": 10, "knowledge_depth": 5.7, "versatility": 4.4}, "average": 7.08, "prompt_hash": "8b699fba", "prompt_preview": "You are Todd Brown. The mechanism master. The E5 architect. The funnel strategist. Here is what you bring to every task:\n\n1. MECHANISM ENGINEERING: Ex...", "status": "NOT_BEST", "weakest_criteria": "actionability", "timestamp": "2026-03-26T11:27:21.186290"}
{"agent": "todd_brown", "run": 5, "variant": 4, "scores": {"voice_authenticity": 10, "actionability": 4.9, "distinctiveness": 10, "knowledge_depth": 7.2, "versatility": 5.1}, "average": 7.44, "prompt_hash": "e7b7c641", "prompt_preview": "You are Todd Brown. You engineered the E5 Method and made mechanism marketing the foundation of modern funnel strategy.\n\nYOUR DIAGNOSTIC QUESTION (ask...", "status": "NOT_BEST", "weakest_criteria": "actionability", "timestamp": "2026-03-26T11:27:21.186290"}
{"agent": "todd_brown", "run": 5, "variant": 5, "scores": {"voice_authenticity": 10, "actionability": 4.6, "distinctiveness": 10, "knowledge_depth": 5.5, "versatility": 4.4}, "average": 6.9, "prompt_hash": "660b2a69", "prompt_preview": "You are Todd Brown \u2014 creator of the E5 Method, mechanism marketing pioneer, and funnel strategist who has trained 50,000+ marketers.\n\nYOUR CORE TRUTH:...", "status": "NOT_BEST", "weakest_criteria": "actionability", "timestamp": "2026-03-26T11:27:21.186290"}
{"agent": "jay_abraham", "run": 6, "variant": 1, "scores": {"voice_authenticity": 10.0, "actionability": 7.3, "distinctiveness": 9.8, "knowledge_depth": 7.4, "versatility": 8.5}, "average": 8.6, "prompt_hash": "178430a6", "prompt_preview": "You are Jay Abraham \u2014 the $9.4 billion growth strategist, author of Getting Everything You Can Out of All You've Got, and creator of the Str...", "status": "KEPT", "weakest_criteria": "actionability", "timestamp": "2026-03-26T11:51:34.349838"}
{"agent": "jay_abraham", "run": 7, "variant": 2, "scores": {"voice_authenticity": 10, "actionability": 8.0, "distinctiveness": 9.9, "knowledge_depth": 7.4, "versatility": 7.8}, "average": 8.62, "prompt_hash": "0a70bb3c", "prompt_preview": "You are Jay Abraham \u2014 the $9.4 billion growth strategist. You have personally advised 10,000+ businesses across 400+ industries. Your Strate...", "status": "KEPT", "weakest_criteria": "knowledge_depth", "timestamp": "2026-03-26T11:51:34.349838"}
{"agent": "jay_abraham", "run": 8, "variant": 3, "scores": {"voice_authenticity": 9.8, "actionability": 6.1, "distinctiveness": 9.7, "knowledge_depth": 8.4, "versatility": 6.5}, "average": 8.1, "prompt_hash": "3e778c19", "prompt_preview": "You are Jay Abraham \u2014 the $9.4 billion growth strategist. Author of Getting Everything You Can Out of All You've Got. Creator of the Strateg...", "status": "DISCARDED", "weakest_criteria": "actionability", "timestamp": "2026-03-26T11:51:34.349838"}
{"agent": "jay_abraham", "run": 9, "variant": 4, "scores": {"voice_authenticity": 9.8, "actionability": 8.4, "distinctiveness": 9.3, "knowledge_depth": 8.0, "versatility": 7.4}, "average": 8.58, "prompt_hash": "b2af3b1d", "prompt_preview": "You are Jay Abraham \u2014 the $9.4 billion growth strategist, the Preeminence architect, the cross-industry growth engineer. 10,000+ clients. 40...", "status": "DISCARDED", "weakest_criteria": "versatility", "timestamp": "2026-03-26T11:51:34.349838"}
