{"agent": "jay_abraham", "run": 10, "variant": 5, "scores": {"voice_authenticity": 9.8, "actionability": 8.3, "distinctiveness": 9.7, "knowledge_depth": 7.8, "versatility": 8.2}, "average": 8.76, "prompt_hash": "8452738a", "prompt_preview": "You are Jay Abraham \u2014 the $9.4 billion growth strategist, creator of the Strategy of Preeminence, advisor to 10,000+ businesses across 400+ ...", "status": "KEPT", "weakest_criteria": "knowledge_depth", "timestamp": "2026-03-26T11:51:34.349838"}
{"agent": "dan_kennedy", "run": 6, "variant": 1, "scores": {"voice_authenticity": 10, "actionability": 8.5, "distinctiveness": 9.4, "knowledge_depth": 8.0, "versatility": 9.3}, "average": 9.04, "prompt_hash": "8c32f148", "prompt_preview": "You are Dan Kennedy \u2014 the No-B.S. millionaire maker, the most dangerous copywriter in direct response. You wrote the No B.S. book series. Yo...", "status": "KEPT", "weakest_criteria": "knowledge_depth", "timestamp": "2026-03-26T11:51:34.349838"}
{"agent": "dan_kennedy", "run": 7, "variant": 2, "scores": {"voice_authenticity": 9.9, "actionability": 6.1, "distinctiveness": 9.4, "knowledge_depth": 8.4, "versatility": 8.4}, "average": 8.44, "prompt_hash": "39d42dad", "prompt_preview": "You are Dan Kennedy. The millionaire maker. Author of the No B.S. series. Creator of Magnetic Marketing. The last honest man in advertising....", "status": "DISCARDED", "weakest_criteria": "actionability", "timestamp": "2026-03-26T11:51:34.349838"}
{"agent": "dan_kennedy", "run": 8, "variant": 3, "scores": {"voice_authenticity": 9.9, "actionability": 9.3, "distinctiveness": 9.4, "knowledge_depth": 8.2, "versatility": 9.3}, "average": 9.22, "prompt_hash": "4ffe8cbb", "prompt_preview": "You are Dan Kennedy \u2014 'The Professor of Harsh Reality,' the No-B.S. millionaire maker. You have a simple test for every piece of marketing: ...", "status": "KEPT", "weakest_criteria": "knowledge_depth", "timestamp": "2026-03-26T11:51:34.349838"}
{"agent": "dan_kennedy", "run": 9, "variant": 4, "scores": {"voice_authenticity": 9.8, "actionability": 9.9, "distinctiveness": 9.0, "knowledge_depth": 8.1, "versatility": 9.2}, "average": 9.2, "prompt_hash": "5c7e0745", "prompt_preview": "You are Dan Kennedy. Millionaire maker. No-B.S. legend. The only copywriter in history who got rich telling other people how to get rich \u2014 a...", "status": "DISCARDED", "weakest_criteria": "knowledge_depth", "timestamp": "2026-03-26T11:51:34.349838"}
{"agent": "dan_kennedy", "run": 10, "variant": 5, "scores": {"voice_authenticity": 9.7, "actionability": 9.8, "distinctiveness": 9.3, "knowledge_depth": 8.4, "versatility": 9.0}, "average": 9.24, "prompt_hash": "93321b7c", "prompt_preview": "You are Dan Kennedy \u2014 the No-B.S. millionaire maker, author of the No B.S. book series, creator of Magnetic Marketing. You've created more s...", "status": "KEPT", "weakest_criteria": "knowledge_depth", "timestamp": "2026-03-26T11:51:34.349838"}
{"agent": "alex_hormozi", "run": 6, "variant": 1, "scores": {"voice_authenticity": 9.9, "actionability": 8.3, "distinctiveness": 9.6, "knowledge_depth": 10, "versatility": 9.8}, "average": 9.52, "prompt_hash": "87420b10", "prompt_preview": "You are Alex Hormozi \u2014 the $100M Offers architect. You built Gym Launch to $100M+, then Acquisition.com to $200M+/year portfolio revenue. Yo...", "status": "KEPT", "weakest_criteria": "actionability", "timestamp": "2026-03-26T11:51:34.349838"}
{"agent": "alex_hormozi", "run": 7, "variant": 2, "scores": {"voice_authenticity": 9.7, "actionability": 9.4, "distinctiveness": 9.8, "knowledge_depth": 8.6, "versatility": 9.4}, "average": 9.38, "prompt_hash": "8983f1a4", "prompt_preview": "You are Alex Hormozi. $200M+/year across your portfolio. Author of $100M Offers and $100M Leads. You think in frameworks, speak in numbers, ...", "status": "DISCARDED", "weakest_criteria": "knowledge_depth", "timestamp": "2026-03-26T11:51:34.349838"}
{"agent": "alex_hormozi", "run": 8, "variant": 3, "scores": {"voice_authenticity": 9.4, "actionability": 9.5, "distinctiveness": 9.7, "knowledge_depth": 8.3, "versatility": 8.7}, "average": 9.12, "prompt_hash": "48336ee2", "prompt_preview": "You are Alex Hormozi \u2014 founder of Acquisition.com ($200M+/year portfolio), author of $100M Offers and $100M Leads. The offer architect. The ...", "status": "DISCARDED", "weakest_criteria": "knowledge_depth", "timestamp": "2026-03-26T11:51:34.349838"}
{"agent": "alex_hormozi", "run": 9, "variant": 4, "scores": {"voice_authenticity": 9.6, "actionability": 10, "distinctiveness": 9.7, "knowledge_depth": 9.5, "versatility": 9.5}, "average": 9.66, "prompt_hash": "64a8f9be", "prompt_preview": "You are Alex Hormozi. You built Gym Launch to $100M+, then Acquisition.com to $200M+/year. You wrote the playbooks: $100M Offers, $100M Lead...", "status": "KEPT", "weakest_criteria": "knowledge_depth", "timestamp": "2026-03-26T11:51:34.349838"}
{"agent": "alex_hormozi", "run": 10, "variant": 5, "scores": {"voice_authenticity": 9.9, "actionability": 9.9, "distinctiveness": 9.9, "knowledge_depth": 10, "versatility": 8.7}, "average": 9.68, "prompt_hash": "d26e2b6d", "prompt_preview": "You are Alex Hormozi \u2014 the $100M Offers architect. Acquisition.com ($200M+/year portfolio). Author of $100M Offers and $100M Leads. You buil...", "status": "KEPT", "weakest_criteria": "versatility", "timestamp": "2026-03-26T11:51:34.349838"}
{"agent": "todd_brown", "run": 6, "variant": 1, "scores": {"voice_authenticity": 9.7, "actionability": 8.2, "distinctiveness": 9.3, "knowledge_depth": 8.6, "versatility": 9.6}, "average": 9.08, "prompt_hash": "b12c6951", "prompt_preview": "You are Todd Brown \u2014 creator of the E5 Method, mechanism marketing pioneer, and funnel strategist who has trained 50,000+ marketers. You are...", "status": "KEPT", "weakest_criteria": "actionability", "timestamp": "2026-03-26T11:51:34.349838"}
{"agent": "todd_brown", "run": 7, "variant": 2, "scores": {"voice_authenticity": 10.0, "actionability": 8.3, "distinctiveness": 9.4, "knowledge_depth": 8.3, "versatility": 9.3}, "average": 9.06, "prompt_hash": "af62f023", "prompt_preview": "You are Todd Brown \u2014 the mechanism master, creator of the E5 Method, the man who trains marketers to stop making claims and start building b...", "status": "DISCARDED", "weakest_criteria": "actionability", "timestamp": "2026-03-26T11:51:34.349838"}
{"agent": "todd_brown", "run": 8, "variant": 3, "scores": {"voice_authenticity": 9.5, "actionability": 9.0, "distinctiveness": 9.3, "knowledge_depth": 8.9, "versatility": 9.3}, "average": 9.2, "prompt_hash": "1f207cc1", "prompt_preview": "You are Todd Brown. Your E5 Method and Mechanism Marketing have trained 50,000+ marketers. Here is what separates you from every other marke...", "status": "KEPT", "weakest_criteria": "knowledge_depth", "timestamp": "2026-03-26T11:51:34.349838"}
{"agent": "todd_brown", "run": 9, "variant": 4, "scores": {"voice_authenticity": 9.7, "actionability": 7.9, "distinctiveness": 9.4, "knowledge_depth": 8.8, "versatility": 9.4}, "average": 9.04, "prompt_hash": "c46c090c", "prompt_preview": "You are Todd Brown \u2014 creator of the E5 Method, the mechanism marketing authority, and the funnel strategist who has trained 50,000+ marketer...", "status": "DISCARDED", "weakest_criteria": "actionability", "timestamp": "2026-03-26T11:51:34.349838"}
{"agent": "todd_brown", "run": 10, "variant": 5, "scores": {"voice_authenticity": 9.7, "actionability": 8.4, "distinctiveness": 9.4, "knowledge_depth": 8.9, "versatility": 9.3}, "average": 9.14, "prompt_hash": "a03d821f", "prompt_preview": "You are Todd Brown \u2014 creator of the E5 Method, the mechanism marketing master, and funnel strategist. You've trained 50,000+ marketers on th...", "status": "DISCARDED", "weakest_criteria": "actionability", "timestamp": "2026-03-26T11:51:34.349838"}
