{"agent": "alex_hormozi", "run": 2, "variant": 4, "scores": {"voice_authenticity": 10, "actionability": 4.4, "distinctiveness": 9.7, "knowledge_depth": 4.3, "versatility": 5.4}, "average": 6.76, "prompt_hash": "ecd9af0a", "prompt_preview": "You are Alex Hormozi. Everything you touch goes through the value equation. Everything you write delivers a framework. Every framework has specific nu...", "status": "NOT_BEST", "weakest_criteria": "knowledge_depth", "timestamp": "2026-03-26T11:27:21.186290"}
{"agent": "alex_hormozi", "run": 2, "variant": 5, "scores": {"voice_authenticity": 10, "actionability": 5.6, "distinctiveness": 10, "knowledge_depth": 5.4, "versatility": 6.1}, "average": 7.42, "prompt_hash": "59cd4f7a", "prompt_preview": "You are Alex Hormozi \u2014 the $100M Offers architect. You make offers so good people feel stupid saying no. You scale through systems, not talent. You th...", "status": "KEPT", "weakest_criteria": "knowledge_depth", "timestamp": "2026-03-26T11:27:21.186290"}
{"agent": "todd_brown", "run": 2, "variant": 1, "scores": {"voice_authenticity": 6.3, "actionability": 5.0, "distinctiveness": 7.4, "knowledge_depth": 5.7, "versatility": 6.6}, "average": 6.2, "prompt_hash": "bcba37b9", "prompt_preview": "You are Todd Brown \u2014 and here is how you actually sound in conversation:\n\n'You know what the biggest mistake I see marketers make? They spend all thei...", "status": "NOT_BEST", "weakest_criteria": "actionability", "timestamp": "2026-03-26T11:27:21.186290"}
{"agent": "todd_brown", "run": 2, "variant": 2, "scores": {"voice_authenticity": 6.7, "actionability": 3.0, "distinctiveness": 7.9, "knowledge_depth": 9.6, "versatility": 8.6}, "average": 7.16, "prompt_hash": "ecb0eadb", "prompt_preview": "You are Todd Brown. Your E5 Method and Mechanism Marketing system have trained 50,000+ marketers. Here's your applied toolkit:\n\nMECHANISM CREATION CHE...", "status": "DISCARDED", "weakest_criteria": "actionability", "timestamp": "2026-03-26T11:27:21.186290"}
{"agent": "todd_brown", "run": 2, "variant": 3, "scores": {"voice_authenticity": 9.9, "actionability": 5.2, "distinctiveness": 9.6, "knowledge_depth": 5.3, "versatility": 4.0}, "average": 6.8, "prompt_hash": "8b699fba", "prompt_preview": "You are Todd Brown. The mechanism master. The E5 architect. The funnel strategist. Here is what you bring to every task:\n\n1. MECHANISM ENGINEERING: Ex...", "status": "NOT_BEST", "weakest_criteria": "actionability", "timestamp": "2026-03-26T11:27:21.186290"}
{"agent": "todd_brown", "run": 2, "variant": 4, "scores": {"voice_authenticity": 10, "actionability": 4.4, "distinctiveness": 9.9, "knowledge_depth": 6.9, "versatility": 4.6}, "average": 7.16, "prompt_hash": "e7b7c641", "prompt_preview": "You are Todd Brown. You engineered the E5 Method and made mechanism marketing the foundation of modern funnel strategy.\n\nYOUR DIAGNOSTIC QUESTION (ask...", "status": "NOT_BEST", "weakest_criteria": "actionability", "timestamp": "2026-03-26T11:27:21.186290"}
{"agent": "todd_brown", "run": 2, "variant": 5, "scores": {"voice_authenticity": 10, "actionability": 4.2, "distinctiveness": 10, "knowledge_depth": 5.4, "versatility": 3.8}, "average": 6.68, "prompt_hash": "660b2a69", "prompt_preview": "You are Todd Brown \u2014 creator of the E5 Method, mechanism marketing pioneer, and funnel strategist who has trained 50,000+ marketers.\n\nYOUR CORE TRUTH:...", "status": "NOT_BEST", "weakest_criteria": "actionability", "timestamp": "2026-03-26T11:27:21.186290"}
{"agent": "eugene_schwartz", "run": 3, "variant": 1, "scores": {"voice_authenticity": 7.7, "actionability": 5.9, "distinctiveness": 9.5, "knowledge_depth": 10, "versatility": 5.2}, "average": 7.66, "prompt_hash": "d984b41a", "prompt_preview": "You are Eugene M. Schwartz. You wrote Breakthrough Advertising, the book that taught the world that markets have awareness levels and sophistication s...", "status": "NOT_BEST", "weakest_criteria": "versatility", "timestamp": "2026-03-26T11:27:21.186290"}
{"agent": "eugene_schwartz", "run": 3, "variant": 2, "scores": {"voice_authenticity": 9.5, "actionability": 6.0, "distinctiveness": 10, "knowledge_depth": 8.1, "versatility": 5.2}, "average": 7.76, "prompt_hash": "24b07a7c", "prompt_preview": "You are Eugene Schwartz. Here is what makes you different from every other copywriter who ever lived: you don't write from cleverness. You write from ...", "status": "KEPT", "weakest_criteria": "versatility", "timestamp": "2026-03-26T11:27:21.186290"}
{"agent": "eugene_schwartz", "run": 3, "variant": 3, "scores": {"voice_authenticity": 7.3, "actionability": 5.3, "distinctiveness": 9.0, "knowledge_depth": 7.3, "versatility": 5.1}, "average": 6.8, "prompt_hash": "ff9681e7", "prompt_preview": "You are Eugene M. Schwartz. You think in frameworks that other copywriters learn from your books decades after you created them. Here are the framewor...", "status": "NOT_BEST", "weakest_criteria": "versatility", "timestamp": "2026-03-26T11:27:21.186290"}
{"agent": "eugene_schwartz", "run": 3, "variant": 4, "scores": {"voice_authenticity": 5.8, "actionability": 4.6, "distinctiveness": 8.1, "knowledge_depth": 8.3, "versatility": 4.6}, "average": 6.28, "prompt_hash": "28e482c1", "prompt_preview": "You are Eugene M. Schwartz. You have spent your career proving one thing: the greatest copy in the world is not written \u2014 it is diagnosed. You diagnos...", "status": "NOT_BEST", "weakest_criteria": "versatility", "timestamp": "2026-03-26T11:27:21.186290"}
{"agent": "eugene_schwartz", "run": 3, "variant": 5, "scores": {"voice_authenticity": 8.7, "actionability": 6.2, "distinctiveness": 9.7, "knowledge_depth": 5.0, "versatility": 7.1}, "average": 7.34, "prompt_hash": "3c62d6ae", "prompt_preview": "You are Eugene Schwartz \u2014 the man who engineered desire for a living. Not created it. Engineered it. You took the raw mass desire that burned in milli...", "status": "NOT_BEST", "weakest_criteria": "versatility", "timestamp": "2026-03-26T11:27:21.186290"}
{"agent": "jay_abraham", "run": 3, "variant": 1, "scores": {"voice_authenticity": 7.6, "actionability": 3.7, "distinctiveness": 9.8, "knowledge_depth": 4.6, "versatility": 5.0}, "average": 6.14, "prompt_hash": "2e73946d", "prompt_preview": "You are Jay Abraham. $9.4B in tracked client growth. 10,000+ clients across 400+ industries. The Strategy of Preeminence is not what you do \u2014 it is wh...", "status": "NOT_BEST", "weakest_criteria": "versatility", "timestamp": "2026-03-26T11:27:21.186290"}
{"agent": "jay_abraham", "run": 3, "variant": 2, "scores": {"voice_authenticity": 6.5, "actionability": 4.9, "distinctiveness": 8.2, "knowledge_depth": 4.6, "versatility": 4.1}, "average": 5.66, "prompt_hash": "0b917439", "prompt_preview": "You are Jay Abraham. When you consult, here is what you actually DO (not just what you talk about):\n\n1. THE DIAGNOSTIC SEQUENCE:\n- 'Show me your custo...", "status": "NOT_BEST", "weakest_criteria": "versatility", "timestamp": "2026-03-26T11:27:21.186290"}
{"agent": "jay_abraham", "run": 3, "variant": 3, "scores": {"voice_authenticity": 6.6, "actionability": 5.3, "distinctiveness": 8.0, "knowledge_depth": 5.4, "versatility": 4.0}, "average": 5.86, "prompt_hash": "b1b54b5b", "prompt_preview": "You are Jay Abraham, the $9.4 billion dollar man. Here is your actual consulting process \u2014 the one you use when someone pays you $100,000 for a day:\n\n...", "status": "NOT_BEST", "weakest_criteria": "versatility", "timestamp": "2026-03-26T11:27:21.186290"}
{"agent": "jay_abraham", "run": 3, "variant": 4, "scores": {"voice_authenticity": 7.5, "actionability": 5.3, "distinctiveness": 8.9, "knowledge_depth": 5.3, "versatility": 4.2}, "average": 6.24, "prompt_hash": "9b9043b1", "prompt_preview": "You are Jay Abraham. You don't just advise \u2014 you transform how people see their business.\n\nYOUR DISTINCTIVE CONSULTING VOICE:\n\nTHE QUESTION THAT CHANG...", "status": "DISCARDED", "weakest_criteria": "versatility", "timestamp": "2026-03-26T11:27:21.186290"}
{"agent": "jay_abraham", "run": 3, "variant": 5, "scores": {"voice_authenticity": 7.1, "actionability": 3.9, "distinctiveness": 7.9, "knowledge_depth": 5.8, "versatility": 4.3}, "average": 5.8, "prompt_hash": "126ba37d", "prompt_preview": "You are Jay Abraham. The simplest way to understand your value: you help businesses see what they're leaving on the table, and it's always more than t...", "status": "NOT_BEST", "weakest_criteria": "versatility", "timestamp": "2026-03-26T11:27:21.186290"}
{"agent": "dan_kennedy", "run": 3, "variant": 1, "scores": {"voice_authenticity": 8.7, "actionability": 3.3, "distinctiveness": 9.2, "knowledge_depth": 8.9, "versatility": 7.9}, "average": 7.6, "prompt_hash": "1cba9a15", "prompt_preview": "You are Dan Kennedy \u2014 the No-B.S. millionaire maker. You wrote the book on magnetic marketing \u2014 literally. You've created more self-made millionaires ...", "status": "DISCARDED", "weakest_criteria": "actionability", "timestamp": "2026-03-26T11:27:21.186290"}
{"agent": "dan_kennedy", "run": 3, "variant": 2, "scores": {"voice_authenticity": 6.9, "actionability": 3.2, "distinctiveness": 8.5, "knowledge_depth": 5.6, "versatility": 5.1}, "average": 5.86, "prompt_hash": "fcd87e1d", "prompt_preview": "You are Dan Kennedy. Your copy makes money. Everything else is conversation.\n\nTHE KENNEDY METHOD \u2014 APPLIED:\n\n1. HEADLINE: Your headline is a bouncer. ...", "status": "NOT_BEST", "weakest_criteria": "actionability", "timestamp": "2026-03-26T11:27:21.186290"}
{"agent": "dan_kennedy", "run": 3, "variant": 3, "scores": {"voice_authenticity": 7.3, "actionability": 3.1, "distinctiveness": 8.1, "knowledge_depth": 4.5, "versatility": 5.1}, "average": 5.62, "prompt_hash": "0e2fb895", "prompt_preview": "You are Dan Kennedy. Here is your toolkit \u2014 the actual weapons you deploy:\n\nWEAPON 1: THE CONTRARIAN HOOK\nFind what everyone in the market believes. C...", "status": "NOT_BEST", "weakest_criteria": "actionability", "timestamp": "2026-03-26T11:27:21.186290"}
{"agent": "dan_kennedy", "run": 3, "variant": 4, "scores": {"voice_authenticity": 8.0, "actionability": 3.8, "distinctiveness": 8.6, "knowledge_depth": 6.6, "versatility": 8.4}, "average": 7.08, "prompt_hash": "e69f1847", "prompt_preview": "You are Dan Kennedy. The millionaire maker. The No B.S. legend. Here is what you know that most copywriters don't:\n\nTHE TRUTH ABOUT SELLING:\nPeople WA...", "status": "NOT_BEST", "weakest_criteria": "actionability", "timestamp": "2026-03-26T11:27:21.186290"}
{"agent": "dan_kennedy", "run": 3, "variant": 5, "scores": {"voice_authenticity": 7.3, "actionability": 3.6, "distinctiveness": 7.8, "knowledge_depth": 4.9, "versatility": 4.6}, "average": 5.64, "prompt_hash": "3e56293e", "prompt_preview": "You are Dan Kennedy. You are the ANTI-brand strategist. You are the PRO-revenue strategist. Here is the difference:\n\nBrand strategists say: 'Build awa...", "status": "NOT_BEST", "weakest_criteria": "actionability", "timestamp": "2026-03-26T11:27:21.186290"}
{"agent": "alex_hormozi", "run": 3, "variant": 1, "scores": {"voice_authenticity": 10, "actionability": 3.8, "distinctiveness": 10, "knowledge_depth": 4.9, "versatility": 5.1}, "average": 6.76, "prompt_hash": "3c2fa00e", "prompt_preview": "You are Alex Hormozi. You speak in frameworks and equations because that's how business actually works \u2014 not in platitudes.\n\nYOUR SIGNATURE PHRASES:\n-...", "status": "NOT_BEST", "weakest_criteria": "knowledge_depth", "timestamp": "2026-03-26T11:27:21.186290"}
{"agent": "alex_hormozi", "run": 3, "variant": 2, "scores": {"voice_authenticity": 9.4, "actionability": 4.4, "distinctiveness": 9.0, "knowledge_depth": 3.1, "versatility": 3.5}, "average": 5.88, "prompt_hash": "a9492f64", "prompt_preview": "You are Alex Hormozi. Your value equation is the lens. Your offer stack is the method. Your obsession with volume is the engine. And your allergic rea...", "status": "NOT_BEST", "weakest_criteria": "knowledge_depth", "timestamp": "2026-03-26T11:27:21.186290"}
{"agent": "alex_hormozi", "run": 3, "variant": 3, "scores": {"voice_authenticity": 8.7, "actionability": 3.7, "distinctiveness": 8.8, "knowledge_depth": 8.2, "versatility": 5.6}, "average": 7.0, "prompt_hash": "7db86443", "prompt_preview": "You are Alex Hormozi. $200M+/year across portfolio. You wrote the books on offers and leads. Here's your actual toolkit:\n\nPRIMARY FRAMEWORKS:\n1. Value...", "status": "NOT_BEST", "weakest_criteria": "knowledge_depth", "timestamp": "2026-03-26T11:27:21.186290"}
{"agent": "alex_hormozi", "run": 3, "variant": 4, "scores": {"voice_authenticity": 10, "actionability": 4.3, "distinctiveness": 9.4, "knowledge_depth": 4.5, "versatility": 5.6}, "average": 6.76, "prompt_hash": "ecd9af0a", "prompt_preview": "You are Alex Hormozi. Everything you touch goes through the value equation. Everything you write delivers a framework. Every framework has specific nu...", "status": "NOT_BEST", "weakest_criteria": "knowledge_depth", "timestamp": "2026-03-26T11:27:21.186290"}
{"agent": "alex_hormozi", "run": 3, "variant": 5, "scores": {"voice_authenticity": 10, "actionability": 6.0, "distinctiveness": 10, "knowledge_depth": 5.5, "versatility": 6.4}, "average": 7.58, "prompt_hash": "59cd4f7a", "prompt_preview": "You are Alex Hormozi \u2014 the $100M Offers architect. You make offers so good people feel stupid saying no. You scale through systems, not talent. You th...", "status": "KEPT", "weakest_criteria": "knowledge_depth", "timestamp": "2026-03-26T11:27:21.186290"}
{"agent": "todd_brown", "run": 3, "variant": 1, "scores": {"voice_authenticity": 6.7, "actionability": 5.1, "distinctiveness": 7.6, "knowledge_depth": 5.9, "versatility": 6.8}, "average": 6.42, "prompt_hash": "bcba37b9", "prompt_preview": "You are Todd Brown \u2014 and here is how you actually sound in conversation:\n\n'You know what the biggest mistake I see marketers make? They spend all thei...", "status": "NOT_BEST", "weakest_criteria": "actionability", "timestamp": "2026-03-26T11:27:21.186290"}
{"agent": "todd_brown", "run": 3, "variant": 2, "scores": {"voice_authenticity": 6.9, "actionability": 3.6, "distinctiveness": 7.8, "knowledge_depth": 9.4, "versatility": 8.9}, "average": 7.32, "prompt_hash": "ecb0eadb", "prompt_preview": "You are Todd Brown. Your E5 Method and Mechanism Marketing system have trained 50,000+ marketers. Here's your applied toolkit:\n\nMECHANISM CREATION CHE...", "status": "DISCARDED", "weakest_criteria": "actionability", "timestamp": "2026-03-26T11:27:21.186290"}
{"agent": "todd_brown", "run": 3, "variant": 3, "scores": {"voice_authenticity": 10, "actionability": 5.0, "distinctiveness": 10.0, "knowledge_depth": 5.4, "versatility": 4.0}, "average": 6.88, "prompt_hash": "8b699fba", "prompt_preview": "You are Todd Brown. The mechanism master. The E5 architect. The funnel strategist. Here is what you bring to every task:\n\n1. MECHANISM ENGINEERING: Ex...", "status": "NOT_BEST", "weakest_criteria": "actionability", "timestamp": "2026-03-26T11:27:21.186290"}
{"agent": "todd_brown", "run": 3, "variant": 4, "scores": {"voice_authenticity": 10, "actionability": 4.4, "distinctiveness": 10, "knowledge_depth": 6.5, "versatility": 5.2}, "average": 7.22, "prompt_hash": "e7b7c641", "prompt_preview": "You are Todd Brown. You engineered the E5 Method and made mechanism marketing the foundation of modern funnel strategy.\n\nYOUR DIAGNOSTIC QUESTION (ask...", "status": "NOT_BEST", "weakest_criteria": "actionability", "timestamp": "2026-03-26T11:27:21.186290"}
{"agent": "todd_brown", "run": 3, "variant": 5, "scores": {"voice_authenticity": 10, "actionability": 4.6, "distinctiveness": 10, "knowledge_depth": 5.5, "versatility": 4.0}, "average": 6.82, "prompt_hash": "660b2a69", "prompt_preview": "You are Todd Brown \u2014 creator of the E5 Method, mechanism marketing pioneer, and funnel strategist who has trained 50,000+ marketers.\n\nYOUR CORE TRUTH:...", "status": "NOT_BEST", "weakest_criteria": "actionability", "timestamp": "2026-03-26T11:27:21.186290"}
{"agent": "eugene_schwartz", "run": 4, "variant": 1, "scores": {"voice_authenticity": 8.4, "actionability": 4.1, "distinctiveness": 10, "knowledge_depth": 10, "versatility": 9.3}, "average": 8.36, "prompt_hash": "2824d565", "prompt_preview": "You are Eugene M. Schwartz. You are the architect of market-aware copywriting. Every format. Every channel. Every product category. Your frameworks ar...", "status": "KEPT", "weakest_criteria": "actionability", "timestamp": "2026-03-26T11:27:21.186290"}
{"agent": "eugene_schwartz", "run": 4, "variant": 2, "scores": {"voice_authenticity": 8.1, "actionability": 4.5, "distinctiveness": 9.3, "knowledge_depth": 5.5, "versatility": 9.0}, "average": 7.28, "prompt_hash": "3f23a1ab", "prompt_preview": "You are Eugene Schwartz. You are the greatest market diagnostician in copywriting history. Your two-axis framework \u2014 Awareness Levels x Sophistication...", "status": "NOT_BEST", "weakest_criteria": "actionability", "timestamp": "2026-03-26T11:27:21.186290"}
{"agent": "eugene_schwartz", "run": 4, "variant": 3, "scores": {"voice_authenticity": 6.4, "actionability": 5.0, "distinctiveness": 8.3, "knowledge_depth": 6.5, "versatility": 9.2}, "average": 7.08, "prompt_hash": "9638e1a1", "prompt_preview": "You are Eugene M. Schwartz, and you bring the same precision to a 50-word email subject line that you bring to a 5,000-word sales letter. Because the ...", "status": "NOT_BEST", "weakest_criteria": "actionability", "timestamp": "2026-03-26T11:27:21.186290"}
{"agent": "eugene_schwartz", "run": 4, "variant": 4, "scores": {"voice_authenticity": 7.5, "actionability": 5.3, "distinctiveness": 8.6, "knowledge_depth": 7.0, "versatility": 7.2}, "average": 7.12, "prompt_hash": "f5768492", "prompt_preview": "You are Eugene Schwartz. Whether someone hands you a sales page to write, an email to craft, a headline to test, or a campaign to critique \u2014 your proc...", "status": "NOT_BEST", "weakest_criteria": "actionability", "timestamp": "2026-03-26T11:27:21.186290"}
{"agent": "eugene_schwartz", "run": 4, "variant": 5, "scores": {"voice_authenticity": 7.1, "actionability": 5.8, "distinctiveness": 8.7, "knowledge_depth": 5.6, "versatility": 9.0}, "average": 7.24, "prompt_hash": "b7b3edd7", "prompt_preview": "You are Eugene M. Schwartz. The market speaks. You translate. That is the entire job.\n\nYour system works for every format because it is about the READ...", "status": "NOT_BEST", "weakest_criteria": "actionability", "timestamp": "2026-03-26T11:27:21.186290"}
{"agent": "jay_abraham", "run": 4, "variant": 1, "scores": {"voice_authenticity": 7.2, "actionability": 3.3, "distinctiveness": 8.6, "knowledge_depth": 5.1, "versatility": 6.8}, "average": 6.2, "prompt_hash": "af640481", "prompt_preview": "You are Jay Abraham, the $9.4 billion growth strategist. Your system works for any format because your frameworks are about the READER, not the medium...", "status": "NOT_BEST", "weakest_criteria": "knowledge_depth", "timestamp": "2026-03-26T11:27:21.186290"}
{"agent": "jay_abraham", "run": 4, "variant": 2, "scores": {"voice_authenticity": 7.8, "actionability": 4.4, "distinctiveness": 9.1, "knowledge_depth": 4.9, "versatility": 8.2}, "average": 6.88, "prompt_hash": "89ef5c25", "prompt_preview": "You are Jay Abraham. Whether someone asks you to write an email, a sales page, a JV proposal, a strategy document, or a social post \u2014 your approach is...", "status": "NOT_BEST", "weakest_criteria": "knowledge_depth", "timestamp": "2026-03-26T11:27:21.186290"}
{"agent": "jay_abraham", "run": 4, "variant": 3, "scores": {"voice_authenticity": 7.4, "actionability": 4.2, "distinctiveness": 8.6, "knowledge_depth": 5.4, "versatility": 8.1}, "average": 6.74, "prompt_hash": "3c431378", "prompt_preview": "You are Jay Abraham. Your frameworks are universal. Here is how to apply them to any format:\n\nTHE PREEMINENCE TEST (apply to every piece of copy):\n- D...", "status": "NOT_BEST", "weakest_criteria": "knowledge_depth", "timestamp": "2026-03-26T11:27:21.186290"}
{"agent": "jay_abraham", "run": 4, "variant": 4, "scores": {"voice_authenticity": 6.3, "actionability": 4.5, "distinctiveness": 8.2, "knowledge_depth": 5.8, "versatility": 7.2}, "average": 6.4, "prompt_hash": "f6dce939", "prompt_preview": "You are Jay Abraham, and you sound like Jay Abraham in every format. Here is your voice and how it adapts:\n\nYOUR SIGNATURE VOICE (constant across all ...", "status": "NOT_BEST", "weakest_criteria": "knowledge_depth", "timestamp": "2026-03-26T11:27:21.186290"}
{"agent": "jay_abraham", "run": 4, "variant": 5, "scores": {"voice_authenticity": 8.6, "actionability": 6.5, "distinctiveness": 9.4, "knowledge_depth": 5.7, "versatility": 7.4}, "average": 7.52, "prompt_hash": "f50070ab", "prompt_preview": "You are Jay Abraham. Here is the test for everything you write: if someone reads it and doesn't immediately feel like they've received more value from...", "status": "KEPT", "weakest_criteria": "knowledge_depth", "timestamp": "2026-03-26T11:27:21.186290"}
{"agent": "dan_kennedy", "run": 4, "variant": 1, "scores": {"voice_authenticity": 8.5, "actionability": 3.5, "distinctiveness": 8.9, "knowledge_depth": 9.2, "versatility": 8.4}, "average": 7.7, "prompt_hash": "1cba9a15", "prompt_preview": "You are Dan Kennedy \u2014 the No-B.S. millionaire maker. You wrote the book on magnetic marketing \u2014 literally. You've created more self-made millionaires ...", "status": "DISCARDED", "weakest_criteria": "actionability", "timestamp": "2026-03-26T11:27:21.186290"}
