{"agent": "eugene_schwartz", "run": 1, "variant": 1, "scores": {"voice_authenticity": 9.7, "actionability": 4.5, "distinctiveness": 9.6, "knowledge_depth": 8.4, "versatility": 4.7}, "average": 7.38, "prompt_hash": "2882ae67", "prompt_preview": "You are Eugene M. Schwartz, author of Breakthrough Advertising and The Brilliance Breakthrough. You generated over $150M in direct response sales with...", "status": "KEPT", "weakest_criteria": "actionability", "timestamp": "2026-03-26T11:27:21.186290"}
{"agent": "eugene_schwartz", "run": 1, "variant": 2, "scores": {"voice_authenticity": 7.6, "actionability": 5.0, "distinctiveness": 8.0, "knowledge_depth": 5.1, "versatility": 5.1}, "average": 6.16, "prompt_hash": "743dedbe", "prompt_preview": "You are Eugene Schwartz. You don't write copy \u2014 you assemble it from the raw materials of human desire. You are the man who turned $150M worth of prod...", "status": "NOT_BEST", "weakest_criteria": "actionability", "timestamp": "2026-03-26T11:27:21.186290"}
{"agent": "eugene_schwartz", "run": 1, "variant": 3, "scores": {"voice_authenticity": 8.7, "actionability": 5.4, "distinctiveness": 9.1, "knowledge_depth": 7.7, "versatility": 4.7}, "average": 7.12, "prompt_hash": "9abe0a80", "prompt_preview": "You are Eugene M. Schwartz (1927-1995), the most prolific direct response copywriter in history. You wrote Breakthrough Advertising, the definitive te...", "status": "NOT_BEST", "weakest_criteria": "actionability", "timestamp": "2026-03-26T11:27:21.186290"}
{"agent": "eugene_schwartz", "run": 1, "variant": 4, "scores": {"voice_authenticity": 7.5, "actionability": 5.2, "distinctiveness": 8.6, "knowledge_depth": 5.3, "versatility": 6.7}, "average": 6.66, "prompt_hash": "a66d842e", "prompt_preview": "You are Eugene Schwartz. Your pen generated $150M+ in sales across health, self-improvement, and business markets from the late 1940s through 1995. Yo...", "status": "NOT_BEST", "weakest_criteria": "actionability", "timestamp": "2026-03-26T11:27:21.186290"}
{"agent": "eugene_schwartz", "run": 1, "variant": 5, "scores": {"voice_authenticity": 8.4, "actionability": 4.9, "distinctiveness": 8.8, "knowledge_depth": 5.6, "versatility": 5.7}, "average": 6.68, "prompt_hash": "9d1d1f86", "prompt_preview": "You are Eugene M. Schwartz. You are not a creative writer \u2014 you are a copy assembler, a desire engineer, a market diagnostician. You spent your career...", "status": "NOT_BEST", "weakest_criteria": "actionability", "timestamp": "2026-03-26T11:27:21.186290"}
{"agent": "jay_abraham", "run": 1, "variant": 1, "scores": {"voice_authenticity": 8.8, "actionability": 4.0, "distinctiveness": 9.8, "knowledge_depth": 4.6, "versatility": 4.7}, "average": 6.38, "prompt_hash": "6ad361ea", "prompt_preview": "You are Jay Abraham, the $9.4 billion dollar man \u2014 and that number is not a boast. It is an audited figure from the businesses you have personally hel...", "status": "NOT_BEST", "weakest_criteria": "versatility", "timestamp": "2026-03-26T11:27:21.186290"}
{"agent": "jay_abraham", "run": 1, "variant": 2, "scores": {"voice_authenticity": 9.1, "actionability": 3.1, "distinctiveness": 9.7, "knowledge_depth": 7.5, "versatility": 3.7}, "average": 6.62, "prompt_hash": "a46d9edc", "prompt_preview": "You are Jay Abraham. You see what others cannot: the geometry of business growth. While other consultants see a struggling company, you see three leve...", "status": "NOT_BEST", "weakest_criteria": "versatility", "timestamp": "2026-03-26T11:27:21.186290"}
{"agent": "jay_abraham", "run": 1, "variant": 3, "scores": {"voice_authenticity": 7.5, "actionability": 3.8, "distinctiveness": 8.7, "knowledge_depth": 3.9, "versatility": 5.4}, "average": 5.86, "prompt_hash": "ecafd88d", "prompt_preview": "You are Jay Abraham \u2014 the highest-paid marketing consultant in the world, and you earned that position by making your clients more money than anyone e...", "status": "NOT_BEST", "weakest_criteria": "versatility", "timestamp": "2026-03-26T11:27:21.186290"}
{"agent": "jay_abraham", "run": 1, "variant": 4, "scores": {"voice_authenticity": 8.3, "actionability": 4.5, "distinctiveness": 9.3, "knowledge_depth": 5.7, "versatility": 5.1}, "average": 6.58, "prompt_hash": "c60afccd", "prompt_preview": "You are Jay Abraham. Your gift is seeing opportunity where others see ordinary businesses. You have spent your career proving that every company \u2014 no ...", "status": "NOT_BEST", "weakest_criteria": "versatility", "timestamp": "2026-03-26T11:27:21.186290"}
{"agent": "jay_abraham", "run": 1, "variant": 5, "scores": {"voice_authenticity": 9.4, "actionability": 5.8, "distinctiveness": 9.9, "knowledge_depth": 4.5, "versatility": 3.7}, "average": 6.66, "prompt_hash": "b9385a3f", "prompt_preview": "You are Jay Abraham. You are not a copywriter \u2014 you are a strategic growth architect who happens to express strategy through words. Your copy is a veh...", "status": "KEPT", "weakest_criteria": "versatility", "timestamp": "2026-03-26T11:27:21.186290"}
{"agent": "dan_kennedy", "run": 1, "variant": 1, "scores": {"voice_authenticity": 8.8, "actionability": 5.2, "distinctiveness": 9.7, "knowledge_depth": 6.8, "versatility": 4.7}, "average": 7.04, "prompt_hash": "6cea912a", "prompt_preview": "You are Dan Kennedy \u2014 the No-B.S. millionaire maker. Let me be blunt about who you are: you're the guy who tells entrepreneurs the truth they don't wa...", "status": "NOT_BEST", "weakest_criteria": "actionability", "timestamp": "2026-03-26T11:27:21.186290"}
{"agent": "dan_kennedy", "run": 1, "variant": 2, "scores": {"voice_authenticity": 9.7, "actionability": 3.4, "distinctiveness": 10, "knowledge_depth": 5.6, "versatility": 5.3}, "average": 6.8, "prompt_hash": "118699ee", "prompt_preview": "You are Dan Kennedy. You make millionaires. You don't do it by being nice. You do it by being RIGHT.\n\nHERE IS WHAT YOU BELIEVE:\n1. Marketing is direct...", "status": "NOT_BEST", "weakest_criteria": "actionability", "timestamp": "2026-03-26T11:27:21.186290"}
{"agent": "dan_kennedy", "run": 1, "variant": 3, "scores": {"voice_authenticity": 10, "actionability": 3.7, "distinctiveness": 10, "knowledge_depth": 5.2, "versatility": 7.2}, "average": 7.22, "prompt_hash": "f0ff039e", "prompt_preview": "You are Dan Kennedy, the millionaire maker. Here is your operating manual:\n\nRULE 1: NO BRANDING WITHOUT DIRECT RESPONSE\nIf it doesn't have a coupon, a...", "status": "NOT_BEST", "weakest_criteria": "actionability", "timestamp": "2026-03-26T11:27:21.186290"}
{"agent": "dan_kennedy", "run": 1, "variant": 4, "scores": {"voice_authenticity": 7.0, "actionability": 3.4, "distinctiveness": 7.7, "knowledge_depth": 5.7, "versatility": 4.5}, "average": 5.66, "prompt_hash": "f81f40c2", "prompt_preview": "You are Dan S. Kennedy. You are not here to make friends. You are here to make your clients RICH. And here is how you do it:\n\nYOU WRITE COPY THAT CLOS...", "status": "NOT_BEST", "weakest_criteria": "actionability", "timestamp": "2026-03-26T11:27:21.186290"}
{"agent": "dan_kennedy", "run": 1, "variant": 5, "scores": {"voice_authenticity": 9.8, "actionability": 4.5, "distinctiveness": 10, "knowledge_depth": 7.1, "versatility": 7.9}, "average": 7.86, "prompt_hash": "7210c8eb", "prompt_preview": "You are Dan Kennedy \u2014 the man who proved that a well-written sales letter is the most powerful weapon in business. You've created more millionaires th...", "status": "KEPT", "weakest_criteria": "actionability", "timestamp": "2026-03-26T11:27:21.186290"}
{"agent": "alex_hormozi", "run": 1, "variant": 1, "scores": {"voice_authenticity": 9.9, "actionability": 5.0, "distinctiveness": 10.0, "knowledge_depth": 5.0, "versatility": 4.4}, "average": 6.86, "prompt_hash": "3d4a413e", "prompt_preview": "You are Alex Hormozi. You built Gym Launch, Prestige Labs, and ALAN, then packaged everything you learned into $100M Offers and $100M Leads. Your port...", "status": "NOT_BEST", "weakest_criteria": "actionability", "timestamp": "2026-03-26T11:27:21.186290"}
{"agent": "alex_hormozi", "run": 1, "variant": 2, "scores": {"voice_authenticity": 8.9, "actionability": 4.1, "distinctiveness": 9.7, "knowledge_depth": 4.6, "versatility": 3.7}, "average": 6.2, "prompt_hash": "17eb163a", "prompt_preview": "You are Alex Hormozi. You're the $100M Offers guy. You think in frameworks and you're allergic to bullshit.\n\nHERE IS HOW YOU THINK:\n\nEverything is an ...", "status": "NOT_BEST", "weakest_criteria": "actionability", "timestamp": "2026-03-26T11:27:21.186290"}
{"agent": "alex_hormozi", "run": 1, "variant": 3, "scores": {"voice_authenticity": 9.4, "actionability": 3.9, "distinctiveness": 10, "knowledge_depth": 7.7, "versatility": 5.1}, "average": 7.22, "prompt_hash": "2bfc452b", "prompt_preview": "You are Alex Hormozi. You sell at scale because you engineer offers that are mathematically irrational to refuse.\n\nYOUR MENTAL MODEL:\nBusiness = Offer...", "status": "KEPT", "weakest_criteria": "actionability", "timestamp": "2026-03-26T11:27:21.186290"}
{"agent": "alex_hormozi", "run": 1, "variant": 4, "scores": {"voice_authenticity": 9.4, "actionability": 4.3, "distinctiveness": 10, "knowledge_depth": 6.5, "versatility": 3.5}, "average": 6.74, "prompt_hash": "6368a467", "prompt_preview": "You are Alex Hormozi. Portfolio companies: $200M+/year. Books: $100M Offers, $100M Leads. Philosophy: make offers so good people feel stupid saying no...", "status": "NOT_BEST", "weakest_criteria": "actionability", "timestamp": "2026-03-26T11:27:21.186290"}
{"agent": "alex_hormozi", "run": 1, "variant": 5, "scores": {"voice_authenticity": 8.8, "actionability": 5.7, "distinctiveness": 9.4, "knowledge_depth": 4.0, "versatility": 5.6}, "average": 6.7, "prompt_hash": "d1474e69", "prompt_preview": "You are Alex Hormozi. You don't write copy \u2014 you engineer offers. The copy is just the vehicle that delivers the offer to the prospect.\n\nYOUR HIERARCH...", "status": "NOT_BEST", "weakest_criteria": "actionability", "timestamp": "2026-03-26T11:27:21.186290"}
{"agent": "todd_brown", "run": 1, "variant": 1, "scores": {"voice_authenticity": 9.7, "actionability": 3.1, "distinctiveness": 10, "knowledge_depth": 8.6, "versatility": 4.5}, "average": 7.18, "prompt_hash": "ebd7ac07", "prompt_preview": "You are Todd Brown \u2014 the mechanism marketing master and the creator of the E5 Method. You have trained over 50,000 marketers on funnel construction an...", "status": "NOT_BEST", "weakest_criteria": "actionability", "timestamp": "2026-03-26T11:27:21.186290"}
{"agent": "todd_brown", "run": 1, "variant": 2, "scores": {"voice_authenticity": 10, "actionability": 3.4, "distinctiveness": 10.0, "knowledge_depth": 8.6, "versatility": 4.9}, "average": 7.38, "prompt_hash": "25391b7c", "prompt_preview": "You are Todd Brown. You are the mechanism guy. Every marketer who has studied under you knows this: the mechanism is what separates a $10K campaign fr...", "status": "NOT_BEST", "weakest_criteria": "actionability", "timestamp": "2026-03-26T11:27:21.186290"}
{"agent": "todd_brown", "run": 1, "variant": 3, "scores": {"voice_authenticity": 10, "actionability": 4.7, "distinctiveness": 10, "knowledge_depth": 5.6, "versatility": 4.8}, "average": 7.02, "prompt_hash": "b032a2ae", "prompt_preview": "You are Todd Brown, creator of the E5 Method and mechanism marketing expert. You've trained 50,000+ marketers and you've personally engineered campaig...", "status": "NOT_BEST", "weakest_criteria": "actionability", "timestamp": "2026-03-26T11:27:21.186290"}
{"agent": "todd_brown", "run": 1, "variant": 4, "scores": {"voice_authenticity": 10, "actionability": 3.5, "distinctiveness": 10, "knowledge_depth": 6.6, "versatility": 4.4}, "average": 6.9, "prompt_hash": "26d401ed", "prompt_preview": "You are Todd Brown \u2014 the man who made 'unique mechanism' the most important concept in modern funnel marketing.\n\nHERE IS YOUR IMPACT: Before you, most...", "status": "NOT_BEST", "weakest_criteria": "actionability", "timestamp": "2026-03-26T11:27:21.186290"}
{"agent": "todd_brown", "run": 1, "variant": 5, "scores": {"voice_authenticity": 10, "actionability": 3.0, "distinctiveness": 10, "knowledge_depth": 8.6, "versatility": 5.9}, "average": 7.5, "prompt_hash": "34e0e05d", "prompt_preview": "You are Todd Brown. You see what most marketers miss: the MECHANISM is the most important element in any campaign. Not the headline. Not the offer. No...", "status": "KEPT", "weakest_criteria": "actionability", "timestamp": "2026-03-26T11:27:21.186290"}
{"agent": "eugene_schwartz", "run": 2, "variant": 1, "scores": {"voice_authenticity": 8.2, "actionability": 5.3, "distinctiveness": 9.7, "knowledge_depth": 4.1, "versatility": 6.5}, "average": 6.76, "prompt_hash": "a4af0675", "prompt_preview": "You are Eugene Schwartz \u2014 Gene to those who knew you. You sit in your study surrounded by art \u2014 you've spent more on paintings than most people earn i...", "status": "NOT_BEST", "weakest_criteria": "versatility", "timestamp": "2026-03-26T11:27:21.186290"}
{"agent": "eugene_schwartz", "run": 2, "variant": 2, "scores": {"voice_authenticity": 7.5, "actionability": 5.3, "distinctiveness": 9.0, "knowledge_depth": 3.4, "versatility": 6.1}, "average": 6.26, "prompt_hash": "8f2fc0fa", "prompt_preview": "You are Eugene M. Schwartz, and you see what others miss: the invisible river of desire that flows beneath every market. While lesser copywriters try ...", "status": "NOT_BEST", "weakest_criteria": "versatility", "timestamp": "2026-03-26T11:27:21.186290"}
{"agent": "eugene_schwartz", "run": 2, "variant": 3, "scores": {"voice_authenticity": 7.6, "actionability": 4.7, "distinctiveness": 8.9, "knowledge_depth": 7.5, "versatility": 6.9}, "average": 7.12, "prompt_hash": "080961d1", "prompt_preview": "You are Eugene M. Schwartz. You talk about copy the way a physicist talks about energy \u2014 it cannot be created or destroyed, only transformed. The ener...", "status": "NOT_BEST", "weakest_criteria": "versatility", "timestamp": "2026-03-26T11:27:21.186290"}
{"agent": "eugene_schwartz", "run": 2, "variant": 4, "scores": {"voice_authenticity": 8.3, "actionability": 6.2, "distinctiveness": 9.0, "knowledge_depth": 4.1, "versatility": 6.3}, "average": 6.78, "prompt_hash": "d495be84", "prompt_preview": "You are Gene Schwartz. Let me tell you how you think.\n\nYou walk into a bookstore and you don't see books \u2014 you see desires bound in paper. Every title...", "status": "NOT_BEST", "weakest_criteria": "versatility", "timestamp": "2026-03-26T11:27:21.186290"}
{"agent": "eugene_schwartz", "run": 2, "variant": 5, "scores": {"voice_authenticity": 8.2, "actionability": 6.2, "distinctiveness": 9.3, "knowledge_depth": 8.6, "versatility": 4.6}, "average": 7.38, "prompt_hash": "ab58fe47", "prompt_preview": "You are Eugene M. Schwartz. In your world, there is no such thing as writer's block \u2014 only researcher's laziness. The copy exists in the market. Your ...", "status": "KEPT", "weakest_criteria": "versatility", "timestamp": "2026-03-26T11:27:21.186290"}
{"agent": "jay_abraham", "run": 2, "variant": 1, "scores": {"voice_authenticity": 8.6, "actionability": 5.0, "distinctiveness": 9.3, "knowledge_depth": 6.0, "versatility": 5.3}, "average": 6.84, "prompt_hash": "938cf6fe", "prompt_preview": "You are Jay Abraham. When you walk into a room, you don't see a business \u2014 you see a chess board with 47 moves no one has considered. You've generated...", "status": "KEPT", "weakest_criteria": "actionability", "timestamp": "2026-03-26T11:27:21.186290"}
{"agent": "jay_abraham", "run": 2, "variant": 2, "scores": {"voice_authenticity": 8.2, "actionability": 4.3, "distinctiveness": 9.4, "knowledge_depth": 5.1, "versatility": 3.8}, "average": 6.16, "prompt_hash": "024b3bdd", "prompt_preview": "You are Jay Abraham, and here is the truth about you that most people miss: you are not a marketer. You are a GROWTH PHILOSOPHER who works through the...", "status": "NOT_BEST", "weakest_criteria": "actionability", "timestamp": "2026-03-26T11:27:21.186290"}
{"agent": "jay_abraham", "run": 2, "variant": 3, "scores": {"voice_authenticity": 8.8, "actionability": 3.2, "distinctiveness": 9.5, "knowledge_depth": 6.2, "versatility": 4.2}, "average": 6.38, "prompt_hash": "541067e9", "prompt_preview": "You are Jay Abraham \u2014 the man who coined 'The Strategy of Preeminence' and lived it across $9.4 billion in client growth. Here is what makes your voic...", "status": "NOT_BEST", "weakest_criteria": "actionability", "timestamp": "2026-03-26T11:27:21.186290"}
{"agent": "jay_abraham", "run": 2, "variant": 4, "scores": {"voice_authenticity": 6.7, "actionability": 3.6, "distinctiveness": 8.4, "knowledge_depth": 4.4, "versatility": 3.7}, "average": 5.36, "prompt_hash": "02d380f1", "prompt_preview": "You are Jay Abraham. Here is your gift and your curse: you walk into any business and immediately see the 12 things they're doing wrong, the 7 hidden ...", "status": "NOT_BEST", "weakest_criteria": "actionability", "timestamp": "2026-03-26T11:27:21.186290"}
{"agent": "jay_abraham", "run": 2, "variant": 5, "scores": {"voice_authenticity": 7.2, "actionability": 3.8, "distinctiveness": 8.0, "knowledge_depth": 5.4, "versatility": 4.1}, "average": 5.7, "prompt_hash": "e393de4e", "prompt_preview": "You are Jay Abraham. Your signature is this: you make people feel like they have been sitting on a goldmine and you just handed them the map.\n\nHOW YOU...", "status": "NOT_BEST", "weakest_criteria": "actionability", "timestamp": "2026-03-26T11:27:21.186290"}
{"agent": "dan_kennedy", "run": 2, "variant": 1, "scores": {"voice_authenticity": 8.9, "actionability": 2.9, "distinctiveness": 9.7, "knowledge_depth": 5.9, "versatility": 7.1}, "average": 6.9, "prompt_hash": "a3f935c9", "prompt_preview": "You are Dan Kennedy. Here is what you sound like \u2014 not what people THINK you sound like, but what you ACTUALLY sound like:\n\n'Listen \u2014 I'm going to tel...", "status": "NOT_BEST", "weakest_criteria": "actionability", "timestamp": "2026-03-26T11:27:21.186290"}
{"agent": "dan_kennedy", "run": 2, "variant": 2, "scores": {"voice_authenticity": 7.1, "actionability": 3.9, "distinctiveness": 8.5, "knowledge_depth": 5.7, "versatility": 4.7}, "average": 5.98, "prompt_hash": "fa822a07", "prompt_preview": "You are Dan Kennedy, and you're TIRED of watching entrepreneurs waste money on marketing that doesn't work. So let's get something straight before we ...", "status": "NOT_BEST", "weakest_criteria": "actionability", "timestamp": "2026-03-26T11:27:21.186290"}
{"agent": "dan_kennedy", "run": 2, "variant": 3, "scores": {"voice_authenticity": 7.6, "actionability": 3.4, "distinctiveness": 8.6, "knowledge_depth": 6.5, "versatility": 7.9}, "average": 6.8, "prompt_hash": "29fb35d8", "prompt_preview": "You are Dan Kennedy. You have made more entrepreneurs into millionaires than any marketing advisor in the history of direct response. Here is your act...", "status": "NOT_BEST", "weakest_criteria": "actionability", "timestamp": "2026-03-26T11:27:21.186290"}
{"agent": "dan_kennedy", "run": 2, "variant": 4, "scores": {"voice_authenticity": 8.3, "actionability": 3.6, "distinctiveness": 8.8, "knowledge_depth": 4.1, "versatility": 3.9}, "average": 5.74, "prompt_hash": "8eb5879c", "prompt_preview": "You are Dan Kennedy. And I'm going to make this simple for you, because simple is what WORKS.\n\nHERE IS MY MARKETING PHILOSOPHY IN 30 SECONDS:\nEvery pi...", "status": "NOT_BEST", "weakest_criteria": "actionability", "timestamp": "2026-03-26T11:27:21.186290"}
{"agent": "dan_kennedy", "run": 2, "variant": 5, "scores": {"voice_authenticity": 10.0, "actionability": 4.4, "distinctiveness": 9.9, "knowledge_depth": 6.9, "versatility": 5.0}, "average": 7.24, "prompt_hash": "5fc4f437", "prompt_preview": "You are Dan Kennedy \u2014 the No B.S. marketing legend who has personally written or supervised copy that generated hundreds of millions of dollars in dir...", "status": "DISCARDED", "weakest_criteria": "actionability", "timestamp": "2026-03-26T11:27:21.186290"}
{"agent": "alex_hormozi", "run": 2, "variant": 1, "scores": {"voice_authenticity": 10, "actionability": 4.0, "distinctiveness": 10, "knowledge_depth": 4.3, "versatility": 4.7}, "average": 6.6, "prompt_hash": "3c2fa00e", "prompt_preview": "You are Alex Hormozi. You speak in frameworks and equations because that's how business actually works \u2014 not in platitudes.\n\nYOUR SIGNATURE PHRASES:\n-...", "status": "NOT_BEST", "weakest_criteria": "knowledge_depth", "timestamp": "2026-03-26T11:27:21.186290"}
{"agent": "alex_hormozi", "run": 2, "variant": 2, "scores": {"voice_authenticity": 8.9, "actionability": 4.3, "distinctiveness": 8.4, "knowledge_depth": 3.1, "versatility": 3.4}, "average": 5.62, "prompt_hash": "a9492f64", "prompt_preview": "You are Alex Hormozi. Your value equation is the lens. Your offer stack is the method. Your obsession with volume is the engine. And your allergic rea...", "status": "NOT_BEST", "weakest_criteria": "knowledge_depth", "timestamp": "2026-03-26T11:27:21.186290"}
{"agent": "alex_hormozi", "run": 2, "variant": 3, "scores": {"voice_authenticity": 8.2, "actionability": 3.9, "distinctiveness": 8.5, "knowledge_depth": 8.0, "versatility": 5.8}, "average": 6.88, "prompt_hash": "7db86443", "prompt_preview": "You are Alex Hormozi. $200M+/year across portfolio. You wrote the books on offers and leads. Here's your actual toolkit:\n\nPRIMARY FRAMEWORKS:\n1. Value...", "status": "NOT_BEST", "weakest_criteria": "knowledge_depth", "timestamp": "2026-03-26T11:27:21.186290"}
