{"run":1,"variation":"A","scores":{"open_rate_potential":7,"story_engagement":6,"trust_building":7,"awareness_escalation":6,"sequence_arc":7},"avg":6.6,"status":"DISCARDED","notes":"Solid structure but stories lack specificity. Subject lines too generic. Awareness transitions feel mechanical."}
{"run":1,"variation":"B","scores":{"open_rate_potential":8,"story_engagement":7,"trust_building":7,"awareness_escalation":7,"sequence_arc":7},"avg":7.2,"status":"KEPT","notes":"Strong curiosity hooks in subject lines. Story about the dentist who automated his practice resonated. Trust building through insider stories works. Awareness escalation needs sharper transitions between emails 4-5."}
{"run":1,"variation":"C","scores":{"open_rate_potential":6,"story_engagement":7,"trust_building":6,"awareness_escalation":6,"sequence_arc":6},"avg":6.2,"status":"DISCARDED","notes":"Over-relied on Abraham-style strategic language. Too dense for email. Lost the reader in abstractions. Subject lines lacked Mueller-style curiosity gaps."}
{"run":2,"variation":"A","scores":{"open_rate_potential":8,"story_engagement":8,"trust_building":7,"awareness_escalation":7,"sequence_arc":7},"avg":7.4,"status":"KEPT","notes":"Mutation targeted story_engagement and awareness_escalation from Run 1B. Added concrete case study in email 3. Schwartz picture words improved email 2 and 4. Subject lines maintained strength."}
{"run":2,"variation":"B","scores":{"open_rate_potential":7,"story_engagement":7,"trust_building":8,"awareness_escalation":7,"sequence_arc":7},"avg":7.2,"status":"DISCARDED","notes":"Trust building improved via Kurtz generosity framing but story engagement dropped. Too much giving, not enough narrative tension."}
{"run":2,"variation":"C","scores":{"open_rate_potential":7,"story_engagement":7,"trust_building":7,"awareness_escalation":6,"sequence_arc":7},"avg":6.8,"status":"DISCARDED","notes":"Tried pure Mueller curiosity approach. Great opens but awareness escalation stalled at email 4. Reader stays Solution Aware too long."}
{"run":3,"variation":"A","scores":{"open_rate_potential":8,"story_engagement":8,"trust_building":8,"awareness_escalation":8,"sequence_arc":8},"avg":8.0,"status":"KEPT","notes":"Mutation targeted trust_building and awareness_escalation from Run 2A. Added Kurtz insider story in email 3, Schwartz awareness bridge in email 5. The 'invisible assembly line' metaphor in email 4 created strong Product Aware transition. Sequence arc tightened."}
{"run":3,"variation":"B","scores":{"open_rate_potential":8,"story_engagement":7,"trust_building":8,"awareness_escalation":7,"sequence_arc":8},"avg":7.6,"status":"DISCARDED","notes":"Strong trust and arc but story engagement dipped in emails 2-3. The consultant anecdote felt forced. Abraham preeminence positioning in email 6 was excellent."}
{"run":3,"variation":"C","scores":{"open_rate_potential":7,"story_engagement":8,"trust_building":7,"awareness_escalation":7,"sequence_arc":7},"avg":7.2,"status":"DISCARDED","notes":"Great stories but subject lines regressed. Trust building needs more Kurtz-style generosity. The mechanic analogy in email 5 was strong."}
{"run":4,"variation":"A","scores":{"open_rate_potential":9,"story_engagement":8,"trust_building":8,"awareness_escalation":8,"sequence_arc":8},"avg":8.2,"status":"KEPT","notes":"Mutation targeted open_rate_potential from Run 3A. Subject lines rewritten with Mueller curiosity gaps plus Schwartz specificity. 'The 11-minute meeting that replaced a $74K employee' crushed it. Core sequence maintained strength from Run 3A."}
{"run":4,"variation":"B","scores":{"open_rate_potential":8,"story_engagement":9,"trust_building":8,"awareness_escalation":8,"sequence_arc":8},"avg":8.2,"status":"KEPT-ALT","notes":"Equal avg to 4A. Story engagement peaked with the 'broken conveyor belt' narrative thread. Different strengths - kept as alternate for final comparison."}
{"run":4,"variation":"C","scores":{"open_rate_potential":8,"story_engagement":8,"trust_building":7,"awareness_escalation":8,"sequence_arc":7},"avg":7.6,"status":"DISCARDED","notes":"Trust building regressed when removing Kurtz insider framing. Sequence arc lost cohesion in emails 5-7 transition."}
{"run":5,"variation":"A","scores":{"open_rate_potential":9,"story_engagement":9,"trust_building":9,"awareness_escalation":9,"sequence_arc":9},"avg":9.0,"status":"BEST","notes":"Final mutation combined 4A subject lines with 4B story threading. Added Kurtz generosity reveal in email 5. Schwartz awareness ladder now seamless across all 7 emails. Abraham preeminence CTA in email 7 feels earned, not salesy. Every email ends with a forward-looking hook that creates anticipation for the next."}
{"run":5,"variation":"B","scores":{"open_rate_potential":9,"story_engagement":8,"trust_building":9,"awareness_escalation":8,"sequence_arc":9},"avg":8.6,"status":"DISCARDED","notes":"Very strong but story engagement in emails 3-4 not as tight as 5A. The awareness escalation plateaus briefly at email 4."}
{"run":5,"variation":"C","scores":{"open_rate_potential":8,"story_engagement":9,"trust_building":8,"awareness_escalation":8,"sequence_arc":8},"avg":8.2,"status":"DISCARDED","notes":"Great stories throughout but subject lines slightly less punchy than 5A. Trust building good but lacks the insider revelation that made 5A's email 5 so powerful."}
