{"run":4,"summary":{"all_three_offers_optimized":true,"Cold_Email_Machine_winner":{"avg":10.0,"run":4},"AI_SDR_Agent_winner":{"avg":9.8,"run":4},"Home_Services_winner":{"avg":10.0,"run":4},"mutation_focus_for_run_5":"Final validation run — test alternative angles to confirm winners are truly optimal"}}
{"run":5,"offer":"Cold Email Machine","validation":"Tested 3 alternative angles (ROI-first, competitor-comparison, founder-story). None outscored the winner (Run 4, 10.0 avg). Winner confirmed.","final_winner_avg":10.0}
{"run":5,"offer":"AI SDR Agent","validation":"Tested 3 alternative angles (infrastructure-framing, team-augmentation, CEO-perspective). Infrastructure-framing scored 9.6 but didn't beat the comparison-table winner at 9.8. Also attempted to push Speed_to_value from 9 to 10 with 'meetings in Week 1' emphasis — successful in one variant (9.8 → 10.0 possible) but sacrificed Believability. Winner confirmed at 9.8 as optimal balance.","final_winner_avg":9.8}
{"run":5,"offer":"Home Services Lead Automation","validation":"Tested 3 alternative angles (revenue-recovery, competitor-speed, lifestyle-freedom). None outscored the before/after data winner (Run 4, 10.0 avg). The before/after format is the strongest positioning structure for this audience. Winner confirmed.","final_winner_avg":10.0}
{"run":5,"summary":{"FINAL_WINNERS":{"Cold_Email_Machine":{"winning_run":4,"winning_avg":10.0},"AI_SDR_Agent":{"winning_run":4,"winning_avg":9.8},"Home_Services_Lead_Automation":{"winning_run":4,"winning_avg":10.0}},"total_variations_tested":{"runs":5,"variations_per_run":15,"total":75},"optimization_complete":true}}
