{"run": 1, "variant": 1, "name": "The Friendly Neighbor", "scores": {"reply_likelihood": 5.9, "personalization": 8.8, "value_first": 3.8, "brevity": 9.5, "sequence_flow": 7.1}, "average": 7.02, "email_count": 5, "avg_word_count": 85.0, "timestamp": "2026-03-26T11:27:21.186290", "status": "NOT_BEST", "weakest_criteria": "sequence_flow"}
{"run": 1, "variant": 2, "name": "The Math Doesn't Lie", "scores": {"reply_likelihood": 7.0, "personalization": 7.0, "value_first": 3.9, "brevity": 9.8, "sequence_flow": 5.3}, "average": 6.6, "email_count": 5, "avg_word_count": 65.0, "timestamp": "2026-03-26T11:27:21.186290", "status": "NOT_BEST", "weakest_criteria": "sequence_flow"}
{"run": 1, "variant": 3, "name": "The Charm Offensive", "scores": {"reply_likelihood": 5.6, "personalization": 7.8, "value_first": 3.7, "brevity": 9.0, "sequence_flow": 6.4}, "average": 6.5, "email_count": 5, "avg_word_count": 84.0, "timestamp": "2026-03-26T11:27:21.186290", "status": "NOT_BEST", "weakest_criteria": "sequence_flow"}
{"run": 1, "variant": 4, "name": "The Value-First Sequence", "scores": {"reply_likelihood": 6.5, "personalization": 7.0, "value_first": 7.3, "brevity": 9.8, "sequence_flow": 6.2}, "average": 7.36, "email_count": 5, "avg_word_count": 76.0, "timestamp": "2026-03-26T11:27:21.186290", "status": "KEPT", "weakest_criteria": "sequence_flow"}
{"run": 1, "variant": 5, "name": "The Awareness Ladder", "scores": {"reply_likelihood": 5.9, "personalization": 8.2, "value_first": 4.0, "brevity": 10.0, "sequence_flow": 6.5}, "average": 6.92, "email_count": 5, "avg_word_count": 83.0, "timestamp": "2026-03-26T11:27:21.186290", "status": "NOT_BEST", "weakest_criteria": "sequence_flow"}
{"run": 2, "variant": 1, "name": "The Hyper-Local", "scores": {"reply_likelihood": 6.7, "personalization": 8.9, "value_first": 5.3, "brevity": 10.0, "sequence_flow": 7.4}, "average": 7.66, "email_count": 5, "avg_word_count": 67.0, "timestamp": "2026-03-26T11:27:21.186290", "status": "NOT_BEST", "weakest_criteria": "sequence_flow"}
{"run": 2, "variant": 2, "name": "The Ultra-Brief", "scores": {"reply_likelihood": 8.2, "personalization": 7.9, "value_first": 4.3, "brevity": 9.7, "sequence_flow": 5.5}, "average": 7.12, "email_count": 5, "avg_word_count": 38.0, "timestamp": "2026-03-26T11:27:21.186290", "status": "NOT_BEST", "weakest_criteria": "sequence_flow"}
{"run": 2, "variant": 3, "name": "The Problem Solver", "scores": {"reply_likelihood": 7.7, "personalization": 8.0, "value_first": 4.5, "brevity": 9.8, "sequence_flow": 6.4}, "average": 7.28, "email_count": 5, "avg_word_count": 50.0, "timestamp": "2026-03-26T11:27:21.186290", "status": "NOT_BEST", "weakest_criteria": "sequence_flow"}
{"run": 2, "variant": 4, "name": "The Authority Play", "scores": {"reply_likelihood": 7.8, "personalization": 8.3, "value_first": 6.4, "brevity": 10, "sequence_flow": 6.2}, "average": 7.74, "email_count": 5, "avg_word_count": 49.0, "timestamp": "2026-03-26T11:27:21.186290", "status": "KEPT", "weakest_criteria": "sequence_flow"}
{"run": 2, "variant": 5, "name": "The Seasonal Urgency", "scores": {"reply_likelihood": 7.2, "personalization": 9.4, "value_first": 5.3, "brevity": 9.9, "sequence_flow": 6.8}, "average": 7.72, "email_count": 5, "avg_word_count": 59.0, "timestamp": "2026-03-26T11:27:21.186290", "status": "NOT_BEST", "weakest_criteria": "sequence_flow"}
{"run": 3, "variant": 1, "name": "The Friendly Neighbor", "scores": {"reply_likelihood": 6.2, "personalization": 9.4, "value_first": 4.7, "brevity": 9.5, "sequence_flow": 7.2}, "average": 7.4, "email_count": 5, "avg_word_count": 85.0, "timestamp": "2026-03-26T11:27:21.186290", "status": "NOT_BEST", "weakest_criteria": "sequence_flow"}
{"run": 3, "variant": 2, "name": "The Math Doesn't Lie", "scores": {"reply_likelihood": 7.3, "personalization": 7.1, "value_first": 4.2, "brevity": 9.7, "sequence_flow": 5.6}, "average": 6.78, "email_count": 5, "avg_word_count": 65.0, "timestamp": "2026-03-26T11:27:21.186290", "status": "NOT_BEST", "weakest_criteria": "sequence_flow"}
{"run": 3, "variant": 3, "name": "The Charm Offensive", "scores": {"reply_likelihood": 6.2, "personalization": 8.4, "value_first": 4.3, "brevity": 9.0, "sequence_flow": 7.0}, "average": 6.98, "email_count": 5, "avg_word_count": 84.0, "timestamp": "2026-03-26T11:27:21.186290", "status": "NOT_BEST", "weakest_criteria": "sequence_flow"}
{"run": 3, "variant": 4, "name": "The Value-First Sequence", "scores": {"reply_likelihood": 6.7, "personalization": 7.3, "value_first": 7.7, "brevity": 10, "sequence_flow": 6.6}, "average": 7.66, "email_count": 5, "avg_word_count": 76.0, "timestamp": "2026-03-26T11:27:21.186290", "status": "DISCARDED", "weakest_criteria": "sequence_flow"}
{"run": 3, "variant": 5, "name": "The Awareness Ladder", "scores": {"reply_likelihood": 6.3, "personalization": 8.4, "value_first": 4.7, "brevity": 10.0, "sequence_flow": 6.9}, "average": 7.26, "email_count": 5, "avg_word_count": 83.0, "timestamp": "2026-03-26T11:27:21.186290", "status": "NOT_BEST", "weakest_criteria": "sequence_flow"}
{"run": 4, "variant": 1, "name": "The Hyper-Local", "scores": {"reply_likelihood": 7.4, "personalization": 9.7, "value_first": 5.6, "brevity": 9.7, "sequence_flow": 7.4}, "average": 7.96, "email_count": 5, "avg_word_count": 67.0, "timestamp": "2026-03-26T11:27:21.186290", "status": "NOT_BEST", "weakest_criteria": "value_first"}
{"run": 4, "variant": 2, "name": "The Ultra-Brief", "scores": {"reply_likelihood": 8.6, "personalization": 8.6, "value_first": 4.6, "brevity": 9.9, "sequence_flow": 5.9}, "average": 7.52, "email_count": 5, "avg_word_count": 38.0, "timestamp": "2026-03-26T11:27:21.186290", "status": "NOT_BEST", "weakest_criteria": "value_first"}
{"run": 4, "variant": 3, "name": "The Problem Solver", "scores": {"reply_likelihood": 8.2, "personalization": 8.6, "value_first": 4.9, "brevity": 10, "sequence_flow": 6.6}, "average": 7.66, "email_count": 5, "avg_word_count": 50.0, "timestamp": "2026-03-26T11:27:21.186290", "status": "NOT_BEST", "weakest_criteria": "value_first"}
{"run": 4, "variant": 4, "name": "The Authority Play", "scores": {"reply_likelihood": 7.9, "personalization": 8.2, "value_first": 7.0, "brevity": 9.9, "sequence_flow": 6.5}, "average": 7.9, "email_count": 5, "avg_word_count": 49.0, "timestamp": "2026-03-26T11:27:21.186290", "status": "NOT_BEST", "weakest_criteria": "value_first"}
{"run": 4, "variant": 5, "name": "The Seasonal Urgency", "scores": {"reply_likelihood": 7.4, "personalization": 9.7, "value_first": 5.6, "brevity": 10, "sequence_flow": 7.4}, "average": 8.02, "email_count": 5, "avg_word_count": 59.0, "timestamp": "2026-03-26T11:27:21.186290", "status": "KEPT", "weakest_criteria": "value_first"}
{"run": 5, "variant": 1, "name": "The Friendly Neighbor", "scores": {"reply_likelihood": 6.9, "personalization": 9.7, "value_first": 4.7, "brevity": 9.6, "sequence_flow": 8.0}, "average": 7.78, "email_count": 5, "avg_word_count": 85.0, "timestamp": "2026-03-26T11:27:21.186290", "status": "NOT_BEST", "weakest_criteria": "sequence_flow"}
{"run": 5, "variant": 2, "name": "The Math Doesn't Lie", "scores": {"reply_likelihood": 7.5, "personalization": 7.7, "value_first": 5.0, "brevity": 9.8, "sequence_flow": 6.4}, "average": 7.28, "email_count": 5, "avg_word_count": 65.0, "timestamp": "2026-03-26T11:27:21.186290", "status": "NOT_BEST", "weakest_criteria": "sequence_flow"}
{"run": 5, "variant": 3, "name": "The Charm Offensive", "scores": {"reply_likelihood": 6.7, "personalization": 8.6, "value_first": 4.6, "brevity": 9.3, "sequence_flow": 7.2}, "average": 7.28, "email_count": 5, "avg_word_count": 84.0, "timestamp": "2026-03-26T11:27:21.186290", "status": "NOT_BEST", "weakest_criteria": "sequence_flow"}
{"run": 5, "variant": 4, "name": "The Value-First Sequence", "scores": {"reply_likelihood": 7.1, "personalization": 7.8, "value_first": 7.9, "brevity": 10, "sequence_flow": 6.7}, "average": 7.9, "email_count": 5, "avg_word_count": 76.0, "timestamp": "2026-03-26T11:27:21.186290", "status": "DISCARDED", "weakest_criteria": "sequence_flow"}
{"run": 5, "variant": 5, "name": "The Awareness Ladder", "scores": {"reply_likelihood": 6.9, "personalization": 8.8, "value_first": 4.8, "brevity": 10.0, "sequence_flow": 7.2}, "average": 7.54, "email_count": 5, "avg_word_count": 83.0, "timestamp": "2026-03-26T11:27:21.186290", "status": "NOT_BEST", "weakest_criteria": "sequence_flow"}
{"run": 6, "variant": 1, "name": "The Radical Transparency", "scores": {"reply_likelihood": 8.5, "personalization": 8.3, "value_first": 8.0, "brevity": 9.9, "sequence_flow": 7.7}, "average": 8.48, "email_count": 5, "avg_word_count": 58.8, "timestamp": "2026-03-26T11:51:34.349838", "status": "KEPT", "weakest_criteria": "sequence_flow"}
{"run": 6, "variant": 2, "name": "The Insight-First", "scores": {"reply_likelihood": 7.1, "personalization": 9.5, "value_first": 7.8, "brevity": 10, "sequence_flow": 8.1}, "average": 8.5, "email_count": 5, "avg_word_count": 64.0, "timestamp": "2026-03-26T11:51:34.349838", "status": "KEPT", "weakest_criteria": "reply_likelihood"}
{"run": 6, "variant": 3, "name": "The Volume Math", "scores": {"reply_likelihood": 7.2, "personalization": 8.4, "value_first": 7.0, "brevity": 10.0, "sequence_flow": 7.0}, "average": 7.92, "email_count": 5, "avg_word_count": 56.0, "timestamp": "2026-03-26T11:51:34.349838", "status": "DISCARDED", "weakest_criteria": "value_first"}
{"run": 6, "variant": 4, "name": "The Empathy Sequence", "scores": {"reply_likelihood": 7.4, "personalization": 8.7, "value_first": 6.5, "brevity": 10.0, "sequence_flow": 6.9}, "average": 7.9, "email_count": 5, "avg_word_count": 59.6, "timestamp": "2026-03-26T11:51:34.349838", "status": "DISCARDED", "weakest_criteria": "value_first"}
{"run": 6, "variant": 5, "name": "The Buchan Charm Play", "scores": {"reply_likelihood": 7.8, "personalization": 9.3, "value_first": 5.7, "brevity": 10.0, "sequence_flow": 7.3}, "average": 8.02, "email_count": 5, "avg_word_count": 58.8, "timestamp": "2026-03-26T11:51:34.349838", "status": "DISCARDED", "weakest_criteria": "value_first"}
{"run": 7, "variant": 1, "name": "Radical Transparency v2", "scores": {"reply_likelihood": 8.1, "personalization": 8.4, "value_first": 7.9, "brevity": 10, "sequence_flow": 8.3}, "average": 8.54, "email_count": 5, "avg_word_count": 56.0, "timestamp": "2026-03-26T11:51:34.349838", "status": "KEPT", "weakest_criteria": "value_first"}
{"run": 7, "variant": 2, "name": "Insight-First v2", "scores": {"reply_likelihood": 6.8, "personalization": 8.9, "value_first": 8.5, "brevity": 10, "sequence_flow": 7.9}, "average": 8.42, "email_count": 5, "avg_word_count": 60.4, "timestamp": "2026-03-26T11:51:34.349838", "status": "DISCARDED", "weakest_criteria": "reply_likelihood"}
{"run": 7, "variant": 3, "name": "Volume Math v2", "scores": {"reply_likelihood": 7.2, "personalization": 8.7, "value_first": 7.1, "brevity": 9.9, "sequence_flow": 7.0}, "average": 7.98, "email_count": 5, "avg_word_count": 53.6, "timestamp": "2026-03-26T11:51:34.349838", "status": "DISCARDED", "weakest_criteria": "sequence_flow"}
{"run": 7, "variant": 4, "name": "Empathy Play v2", "scores": {"reply_likelihood": 7.1, "personalization": 8.7, "value_first": 6.6, "brevity": 9.8, "sequence_flow": 7.3}, "average": 7.9, "email_count": 5, "avg_word_count": 57.6, "timestamp": "2026-03-26T11:51:34.349838", "status": "DISCARDED", "weakest_criteria": "value_first"}
{"run": 7, "variant": 5, "name": "Charm + Value Hybrid v2", "scores": {"reply_likelihood": 7.9, "personalization": 9.1, "value_first": 7.3, "brevity": 10, "sequence_flow": 7.8}, "average": 8.42, "email_count": 5, "avg_word_count": 60.4, "timestamp": "2026-03-26T11:51:34.349838", "status": "DISCARDED", "weakest_criteria": "value_first"}
{"run": 8, "variant": 1, "name": "Radical Transparency v3", "scores": {"reply_likelihood": 8.4, "personalization": 8.3, "value_first": 7.7, "brevity": 10, "sequence_flow": 8.6}, "average": 8.6, "email_count": 5, "avg_word_count": 55.6, "timestamp": "2026-03-26T11:51:34.349838", "status": "KEPT", "weakest_criteria": "value_first"}
{"run": 8, "variant": 2, "name": "Insight-First v3", "scores": {"reply_likelihood": 7.0, "personalization": 8.8, "value_first": 8.0, "brevity": 10.0, "sequence_flow": 8.0}, "average": 8.36, "email_count": 5, "avg_word_count": 60.4, "timestamp": "2026-03-26T11:51:34.349838", "status": "DISCARDED", "weakest_criteria": "reply_likelihood"}
{"run": 8, "variant": 3, "name": "Volume Math v3", "scores": {"reply_likelihood": 7.9, "personalization": 8.5, "value_first": 7.3, "brevity": 10.0, "sequence_flow": 7.1}, "average": 8.16, "email_count": 5, "avg_word_count": 53.6, "timestamp": "2026-03-26T11:51:34.349838", "status": "DISCARDED", "weakest_criteria": "sequence_flow"}
{"run": 8, "variant": 4, "name": "Empathy Play v3", "scores": {"reply_likelihood": 7.5, "personalization": 8.5, "value_first": 6.8, "brevity": 10, "sequence_flow": 7.3}, "average": 8.02, "email_count": 5, "avg_word_count": 57.6, "timestamp": "2026-03-26T11:51:34.349838", "status": "DISCARDED", "weakest_criteria": "value_first"}
{"run": 8, "variant": 5, "name": "Charm + Value Hybrid v3", "scores": {"reply_likelihood": 8.1, "personalization": 9.1, "value_first": 7.3, "brevity": 10, "sequence_flow": 7.8}, "average": 8.46, "email_count": 5, "avg_word_count": 60.4, "timestamp": "2026-03-26T11:51:34.349838", "status": "DISCARDED", "weakest_criteria": "value_first"}
{"run": 9, "variant": 1, "name": "Radical Transparency v4", "scores": {"reply_likelihood": 8.7, "personalization": 8.7, "value_first": 7.9, "brevity": 9.8, "sequence_flow": 8.7}, "average": 8.76, "email_count": 5, "avg_word_count": 55.2, "timestamp": "2026-03-26T11:51:34.349838", "status": "KEPT", "weakest_criteria": "value_first"}
{"run": 9, "variant": 2, "name": "Insight-First v4", "scores": {"reply_likelihood": 6.9, "personalization": 9.0, "value_first": 8.5, "brevity": 9.9, "sequence_flow": 8.2}, "average": 8.5, "email_count": 5, "avg_word_count": 60.4, "timestamp": "2026-03-26T11:51:34.349838", "status": "DISCARDED", "weakest_criteria": "reply_likelihood"}
{"run": 9, "variant": 3, "name": "Volume Math v4", "scores": {"reply_likelihood": 7.9, "personalization": 8.2, "value_first": 7.7, "brevity": 9.8, "sequence_flow": 7.8}, "average": 8.28, "email_count": 5, "avg_word_count": 53.6, "timestamp": "2026-03-26T11:51:34.349838", "status": "DISCARDED", "weakest_criteria": "value_first"}
{"run": 9, "variant": 4, "name": "Empathy Play v4", "scores": {"reply_likelihood": 7.2, "personalization": 8.7, "value_first": 6.9, "brevity": 10.0, "sequence_flow": 7.7}, "average": 8.1, "email_count": 5, "avg_word_count": 57.6, "timestamp": "2026-03-26T11:51:34.349838", "status": "DISCARDED", "weakest_criteria": "value_first"}
{"run": 9, "variant": 5, "name": "Charm + Value Hybrid v4", "scores": {"reply_likelihood": 8.2, "personalization": 8.9, "value_first": 7.6, "brevity": 9.9, "sequence_flow": 8.4}, "average": 8.6, "email_count": 5, "avg_word_count": 60.4, "timestamp": "2026-03-26T11:51:34.349838", "status": "DISCARDED", "weakest_criteria": "value_first"}
{"run": 10, "variant": 1, "name": "Radical Transparency v5", "scores": {"reply_likelihood": 8.6, "personalization": 8.3, "value_first": 8.0, "brevity": 10, "sequence_flow": 8.9}, "average": 8.76, "email_count": 5, "avg_word_count": 54.8, "timestamp": "2026-03-26T11:51:34.349838", "status": "DISCARDED", "weakest_criteria": "value_first"}
{"run": 10, "variant": 2, "name": "Insight-First v5", "scores": {"reply_likelihood": 7.0, "personalization": 9.0, "value_first": 8.6, "brevity": 9.9, "sequence_flow": 8.1}, "average": 8.52, "email_count": 5, "avg_word_count": 60.4, "timestamp": "2026-03-26T11:51:34.349838", "status": "DISCARDED", "weakest_criteria": "reply_likelihood"}
{"run": 10, "variant": 3, "name": "Volume Math v5", "scores": {"reply_likelihood": 7.9, "personalization": 8.6, "value_first": 7.4, "brevity": 10, "sequence_flow": 7.8}, "average": 8.34, "email_count": 5, "avg_word_count": 53.6, "timestamp": "2026-03-26T11:51:34.349838", "status": "DISCARDED", "weakest_criteria": "value_first"}
{"run": 10, "variant": 4, "name": "Empathy Play v5", "scores": {"reply_likelihood": 7.2, "personalization": 8.7, "value_first": 6.7, "brevity": 10, "sequence_flow": 7.2}, "average": 7.96, "email_count": 5, "avg_word_count": 57.6, "timestamp": "2026-03-26T11:51:34.349838", "status": "DISCARDED", "weakest_criteria": "value_first"}
{"run": 10, "variant": 5, "name": "Charm + Value Hybrid v5", "scores": {"reply_likelihood": 8.0, "personalization": 9.0, "value_first": 7.0, "brevity": 10, "sequence_flow": 8.3}, "average": 8.46, "email_count": 5, "avg_word_count": 60.4, "timestamp": "2026-03-26T11:51:34.349838", "status": "DISCARDED", "weakest_criteria": "value_first"}
