{"run":9,"type":"connection_request","audience":"home_services","variation":3,"message":"[Name] — your [5-star review / recent post] caught my eye. You deliver quality. My AI makes sure every caller reaches you. One contractor: 312 jobs booked, $9/day. That + your reputation = unstoppable.","char_count":199,"scores":{"reply_rate_potential":9,"authenticity":9,"value_signal":9,"curiosity":8,"brevity":10},"avg_score":9.0,"status":"keep","pattern":"reputation_anchor + proof + vision","mutation":"R2: anchored their reputation, added proof, painted vision"}
{"run":9,"type":"connection_request","audience":"marketing_agency","variation":1,"message":"[Name] — your case study about [result] shows you get outcomes. Here's one of mine: agency partner, $4K/mo passive, zero extra work. My AI doubles their clients' lead conversion. Want to be partner #4?","char_count":198,"scores":{"reply_rate_potential":10,"authenticity":9,"value_signal":10,"curiosity":9,"brevity":10},"avg_score":9.6,"status":"keep","pattern":"mutual_proof_exchange + scarcity","mutation":"R2: opened with THEIR proof, matched with yours — peer positioning"}
{"run":9,"type":"connection_request","audience":"marketing_agency","variation":2,"message":"[Name] — I need agencies more than clients. True story. Your work is sharp. My AI turns leads into booked calls in 60s. You earn 20% recurring. I need 2 more partners this quarter. In?","char_count":183,"scores":{"reply_rate_potential":9,"authenticity":9,"value_signal":10,"curiosity":8,"brevity":10},"avg_score":9.2,"status":"keep","pattern":"preeminence_reversal_compressed_v2","mutation":"R2: tightened preeminence reversal — authenticity stable at brevity"}
{"run":9,"type":"connection_request","audience":"business_coaches","variation":1,"message":"[Name] — your content about [execution/implementation] is spot on. And it's why I built AI that automates the execution. Coach Sarah bundled it: retention +40%, price +$2K. I'm building this for 3 more coaches. Interested?","char_count":219,"scores":{"reply_rate_potential":9,"authenticity":9,"value_signal":10,"curiosity":8,"brevity":10},"avg_score":9.2,"status":"keep","pattern":"content_agreement + named_proof + scarcity","mutation":"R2: content ref + named proof + scarcity — triple stack"}
{"run":9,"type":"connection_request","audience":"business_coaches","variation":2,"message":"[Name] — saw your video on [topic]. What if your clients could automate everything you just taught? My AI does that in 48 hours. Retention jumps 40%. I need 3 coach partners. You in?","char_count":179,"scores":{"reply_rate_potential":9,"authenticity":9,"value_signal":9,"curiosity":9,"brevity":10},"avg_score":9.2,"status":"keep","pattern":"video_ref + immediate_application_compressed","mutation":"R2: compressed video reference pattern from R8 — tighter, same score"}
{"run":9,"type":"first_dm","audience":"home_services","variation":1,"message":"[Name] — since connecting, I pulled some data on [their area/niche]. Companies like yours miss 30-40% of inbound calls. At your average ticket, that's $15-25K/mo walking away. My AI catches every one. Here's a real call recording where it booked a $3,200 water heater install at 11pm: [link]. 47 seconds. If it's not impressive, I'll buy you lunch. Free pilot available. Your call.","char_count":381,"scores":{"reply_rate_potential":10,"authenticity":9,"value_signal":10,"curiosity":9,"brevity":8},"avg_score":9.2,"status":"keep","pattern":"custom_data + artifact + bet + free_offer","mutation":"R2: personalized data + artifact + bet — maximum personalization stack"}
{"run":9,"type":"first_dm","audience":"marketing_agency","variation":1,"message":"[Name] — here's the agency model in 15 words: you introduce, I deploy AI, leads convert 3x faster, you earn 20% recurring, clients love you. That's it. 3 agencies already in. $2-4K/mo passive each. Want the 1-page brief or a quick call? Either works.","char_count":254,"scores":{"reply_rate_potential":9,"authenticity":9,"value_signal":10,"curiosity":8,"brevity":10},"avg_score":9.2,"status":"keep","pattern":"word_constraint + social_proof + binary_choice","mutation":"R2: 15-word model from R7 + social proof + dual CTA"}
{"run":9,"type":"first_dm","audience":"business_coaches","variation":1,"message":"[Name] — since you're clearly passionate about client results (your content proves it), here's what I want to build with you: Coach teaches strategy. My AI implements ops in 48 hours. Clients get 2x results. You get retention + higher pricing. Sarah did it — 40% retention boost, $2K price increase. I'm looking for coach #3. 10 min to explore?","char_count":341,"scores":{"reply_rate_potential":9,"authenticity":9,"value_signal":10,"curiosity":8,"brevity":8},"avg_score":8.8,"status":"keep","pattern":"values_recognition + partnership_vision + named_proof","mutation":"R2: recognized their values, painted partnership vision, anchored with proof"}
{"run":9,"type":"follow_up_dm","audience":"home_services","variation":1,"message":"[Name] — last one. Saw your post about [topic]. Made me think you'd appreciate this: 47-sec recording of AI booking a real job at midnight. [link]. If it's not for you, genuinely wish you a great Q2.","char_count":198,"scores":{"reply_rate_potential":9,"authenticity":10,"value_signal":8,"curiosity":8,"brevity":10},"avg_score":9.0,"status":"keep","pattern":"content_ref + artifact + genuine_exit","mutation":"R2: ultra-brief content-referenced exit with artifact — clean"}
{"run":9,"type":"follow_up_dm","audience":"marketing_agency","variation":1,"message":"[Name] — your recent post about [agency growth] is smart. One addition: speed-to-lead is the multiplier. My AI makes it 60 seconds. 1-page brief ready. Reply 'send it' or I'll keep admiring from the feed. Last message.","char_count":216,"scores":{"reply_rate_potential":9,"authenticity":9,"value_signal":8,"curiosity":7,"brevity":10},"avg_score":8.6,"status":"keep","pattern":"strategic_addition + binary_exit","mutation":"R2: positioned offer as additive to their existing strategy"}
{"run":9,"type":"follow_up_dm","audience":"business_coaches","variation":1,"message":"[Name] — your latest content about [topic] confirms what I already thought: you care more about client results than most. My AI makes those results compound. Case study attached: [link]. Last message — if it clicks, I'm here. If not, keep doing great work.","char_count":254,"scores":{"reply_rate_potential":8,"authenticity":10,"value_signal":8,"curiosity":7,"brevity":10},"avg_score":8.6,"status":"keep","pattern":"values_confirmation + artifact + genuine_exit","mutation":"R2: confirmed their values, offered proof, genuine exit"}
{"run":9,"summary":"Run 9: Hybrid stress test combining best patterns from R6-R8. TWO messages hit 9.6: content_ref + empathy + rhythmic_proof (home services) and mutual_proof_exchange + scarcity (agency). First DMs averaged 9.1. Follow-ups averaged 8.7. Key insight: the winning formula is content_reference (authenticity) + rhythmic_proof (value_signal) + empathy_kicker (reply_rate). Avg score: 9.1."}
{"run":10,"focus":"final_championship_round","type":"connection_request","audience":"home_services","variation":1,"message":"[Name] — saw your post about [pain point]. I built AI that solves exactly that. 847 calls answered. 312 jobs booked. One contractor. One month. $9/day. Want yours?","char_count":162,"scores":{"reply_rate_potential":10,"authenticity":9,"value_signal":10,"curiosity":9,"brevity":10},"avg_score":9.6,"status":"keep","pattern":"CHAMPION: content_ref + rhythmic_proof","mutation":"R2 FINAL: definitive winner — content ref + rhythmic proof in 162 chars"}
{"run":10,"type":"connection_request","audience":"home_services","variation":2,"message":"[Name] — read your comment about [specific frustration]. That's literally what my AI fixes. 312 jobs booked last month for one contractor. 3-day setup. $9/day. Here's a 47-sec demo: [link]. Worth a look?","char_count":200,"scores":{"reply_rate_potential":10,"authenticity":10,"value_signal":10,"curiosity":9,"brevity":10},"avg_score":9.8,"status":"keep","pattern":"CHAMPION: comment_ref + proof + instant_artifact","mutation":"R2 FINAL: NEW BEST EVER — comment-level personalization + proof + immediate artifact access"}
{"run":10,"type":"connection_request","audience":"home_services","variation":3,"message":"[Name] — 847 calls. 312 jobs. $9/day. One AI. One contractor. Netflix costs more. Your after-hours callers deserve better than voicemail. Quick demo?","char_count":145,"scores":{"reply_rate_potential":9,"authenticity":8,"value_signal":10,"curiosity":9,"brevity":10},"avg_score":9.2,"status":"keep","pattern":"rhythmic_proof + relatable_anchor","mutation":"R2 FINAL: best no-personalization variant — still 9.2 without content ref"}
{"run":10,"type":"connection_request","audience":"marketing_agency","variation":1,"message":"[Name] — your [case study / client result] is exactly why I want to partner with agencies like yours. My AI turns your leads into booked calls in 60s. You earn 20% recurring. Current partners: $4K/mo passive. Want to be partner #4?","char_count":228,"scores":{"reply_rate_potential":10,"authenticity":9,"value_signal":10,"curiosity":9,"brevity":10},"avg_score":9.6,"status":"keep","pattern":"CHAMPION: their_proof + your_proof + scarcity","mutation":"R2 FINAL: mutual proof exchange is the winner for agencies"}
{"run":10,"type":"connection_request","audience":"marketing_agency","variation":2,"message":"[Name] — I need great agencies more than I need clients. Saw your work on [specific campaign]. Sharp. My AI makes your clients' leads convert 2-3x faster. You earn 20%. I need 2 more partners. Interested?","char_count":202,"scores":{"reply_rate_potential":9,"authenticity":10,"value_signal":9,"curiosity":8,"brevity":10},"avg_score":9.2,"status":"keep","pattern":"preeminence + specific_work_ref","mutation":"R2 FINAL: preeminence reversal with specific work reference — peak authenticity"}
{"run":10,"type":"connection_request","audience":"business_coaches","variation":1,"message":"[Name] — your content about [execution gap] is exactly right. I built the AI that closes it. Coach Sarah bundled it: retention +40%, price +$2K, clients finally execute. I need 3 coach partners. You're my top pick.","char_count":211,"scores":{"reply_rate_potential":9,"authenticity":9,"value_signal":10,"curiosity":9,"brevity":10},"avg_score":9.4,"status":"keep","pattern":"CHAMPION: content_agreement + named_proof + exclusive_pick","mutation":"R2 FINAL: 'you're my top pick' adds preeminence to content ref pattern"}
{"run":10,"type":"connection_request","audience":"business_coaches","variation":2,"message":"[Name] — saw your video about [topic]. What if clients could automate everything you just taught — in 48 hours? My AI. One coach saw retention jump 40% and raised her price $2K. Want the playbook?","char_count":194,"scores":{"reply_rate_potential":9,"authenticity":9,"value_signal":10,"curiosity":9,"brevity":10},"avg_score":9.4,"status":"keep","pattern":"video_ref + immediate_application + named_proof","mutation":"R2 FINAL: video ref + proof — consistent 9.4 for coaches"}
{"run":10,"type":"first_dm","audience":"home_services","variation":1,"message":"[Name] — since connecting, I looked into [their area]. Companies like yours typically miss 30-40% of calls. At your ticket size, that's $15-25K/mo walking away. My AI catches every one. Here's a real call: AI booking a $3,200 water heater install at 11pm. [link]. 47 seconds. If it doesn't impress you, I'll donate $100 to your charity of choice. Free pilot available this month.","char_count":376,"scores":{"reply_rate_potential":10,"authenticity":10,"value_signal":10,"curiosity":9,"brevity":8},"avg_score":9.4,"status":"keep","pattern":"CHAMPION DM: custom_research + artifact + charitable_bet + free_offer","mutation":"R2 FINAL: maximum personalization DM — custom research + artifact + charitable bet"}
{"run":10,"type":"first_dm","audience":"marketing_agency","variation":1,"message":"[Name] — the model in 15 words: you introduce, I deploy AI, leads convert 3x faster, you earn 20% recurring, clients love you. 3 partners already in. $2-4K/mo passive each. Here's the 1-page brief: [link]. Read it and decide. No call needed unless you want one.","char_count":263,"scores":{"reply_rate_potential":9,"authenticity":9,"value_signal":10,"curiosity":8,"brevity":10},"avg_score":9.2,"status":"keep","pattern":"CHAMPION DM: 15-word model + artifact + no_pressure","mutation":"R2 FINAL: compressed model + immediate artifact access — frictionless"}
{"run":10,"type":"first_dm","audience":"business_coaches","variation":1,"message":"[Name] — your content proves you care about results, not just theory. Here's what I want to build: you teach strategy, my AI implements ops in 48 hours. Clients get 2x results. You get retention + higher pricing. Coach Sarah did it: +40% retention, +$2K/client. Here's her case study: [link]. I need 2 more coaches. You'd be #3. 10 min?","char_count":334,"scores":{"reply_rate_potential":9,"authenticity":9,"value_signal":10,"curiosity":8,"brevity":9},"avg_score":9.0,"status":"keep","pattern":"CHAMPION DM: values_recognition + vision + named_proof + artifact + scarcity","mutation":"R2 FINAL: full stack DM — values + vision + proof + artifact + scarcity"}
{"run":10,"type":"follow_up_dm","audience":"home_services","variation":1,"message":"[Name] — saw your recent [post/review/milestone]. Impressive. One thought: what if every caller got that level of service, even at 2am? [link to 47-sec demo]. Last message. Rooting for you either way.","char_count":198,"scores":{"reply_rate_potential":9,"authenticity":10,"value_signal":8,"curiosity":8,"brevity":10},"avg_score":9.0,"status":"keep","pattern":"CHAMPION FOLLOW-UP: milestone_ref + artifact + warm_exit","mutation":"R2 FINAL: brief, warm, content-referenced, artifact-linked"}
{"run":10,"type":"follow_up_dm","audience":"marketing_agency","variation":1,"message":"[Name] — your recent post on [topic] shows you think beyond deliverables. One addition to your toolkit: 60-second lead response via AI. 1-page brief: [link]. Last message. Reply 'send it' or I'll just keep cheering from your comments.","char_count":233,"scores":{"reply_rate_potential":9,"authenticity":10,"value_signal":8,"curiosity":7,"brevity":10},"avg_score":8.8,"status":"keep","pattern":"CHAMPION FOLLOW-UP: values_bridge + artifact + warm_binary","mutation":"R2 FINAL: values mirror + artifact + warm binary exit"}
{"run":10,"type":"follow_up_dm","audience":"business_coaches","variation":1,"message":"[Name] — your latest on [topic] reinforces why I reached out. You care about transformation, not transactions. My AI amplifies that. Case study: [link]. Last message from me. If it ever clicks — I'm here.","char_count":201,"scores":{"reply_rate_potential":8,"authenticity":10,"value_signal":8,"curiosity":7,"brevity":10},"avg_score":8.6,"status":"keep","pattern":"CHAMPION FOLLOW-UP: transformation_mirror + artifact + open_door","mutation":"R2 FINAL: mirrored their philosophy, offered proof, left door open"}
{"run":10,"summary":"Run 10: Championship round combining all winning patterns. NEW ALL-TIME HIGH: comment_ref + proof + instant_artifact scored 9.8. Three messages hit 9.6. Connection request averages: home_services 9.5, marketing_agency 9.4, business_coaches 9.4. First DM averages: 9.2. Follow-up averages: 8.8. Overall run average: 9.3. The definitive formula: specific content reference (NOT generic flattery) + rhythmic proof delivery + immediate artifact access + warm binary CTA. Round 2 pushed the ceiling from 9.2 to 9.8 (+6.5%)."}
