{"run":1,"type":"connection_request","audience":"home_services","variation":1,"message":"Hey [Name] - I promise this isn't another \"let me pick your brain\" message. I've been geeking out on how AI is quietly revolutionizing home services scheduling and I had to reach out. Fellow automation nerd here.","char_count":229,"scores":{"reply_rate_potential":7,"authenticity":8,"value_signal":6,"curiosity":7,"brevity":9},"avg_score":7.4,"status":"keep","pattern":"buchan_self_deprecating_opener"}
{"run":1,"type":"connection_request","audience":"home_services","variation":2,"message":"[Name], weird question - what would you do with 15 extra hours a week? Asking because I just helped a plumbing company owner get exactly that. No catch, just genuinely curious if you'd even want that problem solved.","char_count":218,"scores":{"reply_rate_potential":8,"authenticity":7,"value_signal":8,"curiosity":8,"brevity":9},"avg_score":8.0,"status":"keep","pattern":"buchan_absurd_question + abraham_preeminence"}
{"run":1,"type":"connection_request","audience":"home_services","variation":3,"message":"Hi [Name], I know you probably get 47 connection requests a day from people selling stuff. This isn't that. I study how AI helps contractors win back their weekends. Would love to compare notes.","char_count":194,"scores":{"reply_rate_potential":7,"authenticity":8,"value_signal":7,"curiosity":6,"brevity":10},"avg_score":7.6,"status":"keep","pattern":"buchan_acknowledge_pattern"}
{"run":1,"type":"connection_request","audience":"home_services","variation":4,"message":"[Name] - Quick confession: I stalked your profile and got genuinely impressed. Running a home services company AND keeping it growing? I work with owners like you on the AI side. Happy to just connect.","char_count":203,"scores":{"reply_rate_potential":6,"authenticity":7,"value_signal":5,"curiosity":5,"brevity":9},"avg_score":6.4,"status":"discard","pattern":"buchan_flattery_opener","discard_reason":"weak value_signal and curiosity"}
{"run":1,"type":"connection_request","audience":"home_services","variation":5,"message":"[Name], if I told you there's a way to never miss another lead call again - without hiring anyone - you'd probably think it's BS. Fair. But 3 HVAC companies disagree. Worth a connection?","char_count":187,"scores":{"reply_rate_potential":8,"authenticity":6,"value_signal":9,"curiosity":8,"brevity":10},"avg_score":8.2,"status":"keep","pattern":"schwartz_specific_claim + abraham_proof"}
{"run":1,"type":"connection_request","audience":"marketing_agency","variation":1,"message":"[Name] - I have a strange proposition. I build AI systems for home services companies and I need agency partners who actually care about client results. Your work suggests you're one of them.","char_count":194,"scores":{"reply_rate_potential":7,"authenticity":8,"value_signal":7,"curiosity":7,"brevity":10},"avg_score":7.8,"status":"keep","pattern":"buchan_strange_proposition + abraham_partnership"}
{"run":1,"type":"connection_request","audience":"marketing_agency","variation":2,"message":"Hey [Name], quick hypothetical: if your clients' leads were followed up in under 60 seconds by AI, 24/7... would that make you look like a hero or would it put you out of a job? Genuinely curious.","char_count":198,"scores":{"reply_rate_potential":8,"authenticity":7,"value_signal":8,"curiosity":9,"brevity":10},"avg_score":8.4,"status":"keep","pattern":"buchan_hypothetical + abraham_leverage"}
{"run":1,"type":"connection_request","audience":"marketing_agency","variation":3,"message":"[Name], I'll keep this short. I've built an AI system that turns your clients' missed calls into booked jobs. Looking for 2-3 agencies to partner with. Your portfolio caught my eye.","char_count":179,"scores":{"reply_rate_potential":7,"authenticity":7,"value_signal":9,"curiosity":6,"brevity":10},"avg_score":7.8,"status":"keep","pattern":"abraham_direct_value + scarcity"}
{"run":1,"type":"connection_request","audience":"marketing_agency","variation":4,"message":"Alright [Name], I'm going to be weirdly transparent. I'm an AI automation agency owner looking for marketing agencies to send referrals TO. Yes, to. Interested in hearing how that works?","char_count":188,"scores":{"reply_rate_potential":9,"authenticity":9,"value_signal":8,"curiosity":9,"brevity":10},"avg_score":9.0,"status":"keep","pattern":"buchan_radical_transparency + abraham_preeminence_reversal"}
{"run":1,"type":"connection_request","audience":"marketing_agency","variation":5,"message":"[Name] - Most AI companies try to replace agencies. I think that's dumb. I'd rather make you indispensable to your clients. 2 minutes to explain?","char_count":145,"scores":{"reply_rate_potential":8,"authenticity":8,"value_signal":8,"curiosity":7,"brevity":10},"avg_score":8.2,"status":"keep","pattern":"buchan_contrarian + abraham_preeminence"}
{"run":1,"type":"connection_request","audience":"business_coaches","variation":1,"message":"[Name], random outreach but with purpose - I help SMB owners automate the stuff they hate so they can focus on what they love. Sounds like we serve the same people from different angles.","char_count":187,"scores":{"reply_rate_potential":7,"authenticity":8,"value_signal":7,"curiosity":6,"brevity":10},"avg_score":7.6,"status":"keep","pattern":"abraham_alignment + buchan_casual"}
{"run":1,"type":"connection_request","audience":"business_coaches","variation":2,"message":"Hey [Name] - Your coaching clients probably complain about not having enough time, right? What if I could give them 10+ hours back a week with AI? Could make your coaching results look even better.","char_count":196,"scores":{"reply_rate_potential":8,"authenticity":7,"value_signal":9,"curiosity":7,"brevity":10},"avg_score":8.2,"status":"keep","pattern":"abraham_preeminence_enhancement + buchan_conversational"}
{"run":1,"type":"connection_request","audience":"business_coaches","variation":3,"message":"[Name] - Bold claim incoming: I can make your coaching clients get results 2x faster. Not by changing your coaching - by automating the busywork they're drowning in. Intrigued or annoyed?","char_count":187,"scores":{"reply_rate_potential":8,"authenticity":7,"value_signal":8,"curiosity":8,"brevity":10},"avg_score":8.2,"status":"keep","pattern":"buchan_bold_claim + abraham_value_reframe"}
{"run":1,"type":"connection_request","audience":"business_coaches","variation":4,"message":"[Name], I just want to connect with smart people who help business owners grow. You clearly do. I do it through AI automation. No pitch, just professional respect.","char_count":164,"scores":{"reply_rate_potential":5,"authenticity":8,"value_signal":4,"curiosity":4,"brevity":10},"avg_score":6.2,"status":"discard","pattern":"generic_compliment","discard_reason":"weak curiosity and value_signal"}
{"run":1,"type":"connection_request","audience":"business_coaches","variation":5,"message":"[Name] - Here's something your coaching clients probably haven't considered: AI can handle their follow-ups, scheduling, and lead response while they sleep. I'd love to be a resource for your community.","char_count":200,"scores":{"reply_rate_potential":7,"authenticity":7,"value_signal":8,"curiosity":6,"brevity":10},"avg_score":7.6,"status":"keep","pattern":"abraham_resource_positioning"}
{"run":1,"type":"first_dm","audience":"home_services","variation":1,"message":"Thanks for connecting, [Name]! As promised, no sales pitch. Quick question though - what's your biggest headache right now? Missed calls? Scheduling chaos? Finding good techs? I ask because I've spent the last 2 years building AI systems specifically for home services companies, and the problems are hilariously consistent. If any of that resonates, happy to share what's working.","char_count":374,"scores":{"reply_rate_potential":7,"authenticity":8,"value_signal":7,"curiosity":6,"brevity":8},"avg_score":7.2,"status":"keep","pattern":"abraham_diagnostic_question"}
{"run":1,"type":"first_dm","audience":"home_services","variation":2,"message":"[Name]! Appreciate the connect. So here's the deal - I built an AI receptionist that answers calls, books jobs, and follows up with leads for home services companies. One client went from missing 40% of calls to missing zero. I'm not trying to sell you anything today - but if missed revenue from missed calls keeps you up at night, I have ideas. Worth a quick chat?","char_count":365,"scores":{"reply_rate_potential":8,"authenticity":7,"value_signal":9,"curiosity":7,"brevity":8},"avg_score":7.8,"status":"keep","pattern":"abraham_proof + buchan_no_pressure"}
{"run":1,"type":"first_dm","audience":"home_services","variation":3,"message":"Hey [Name], thanks for connecting! Random but relevant: I just helped a plumbing company save $4,200/month by replacing their answering service with AI. Took 3 days to set up. I'm collecting case studies in home services right now - would you be open to a free audit of where AI could save you the most time and money? Zero obligation, genuinely just building my portfolio.","char_count":370,"scores":{"reply_rate_potential":8,"authenticity":7,"value_signal":9,"curiosity":8,"brevity":8},"avg_score":8.0,"status":"keep","pattern":"abraham_generosity + specific_proof"}
{"run":1,"type":"first_dm","audience":"home_services","variation":4,"message":"[Name] - glad we connected! I'll be honest, I reached out because I think there's a massive opportunity in home services that most owners don't know about yet. AI can now answer your phones, qualify leads, book appointments, and follow up - all while sounding completely human. I'm not selling anything. I just love talking about this stuff. Would you be open to seeing a 2-min demo?","char_count":384,"scores":{"reply_rate_potential":7,"authenticity":6,"value_signal":8,"curiosity":7,"brevity":8},"avg_score":7.2,"status":"keep","pattern":"abraham_opportunity_framing"}
{"run":1,"type":"first_dm","audience":"home_services","variation":5,"message":"Hey [Name]! Quick thought after connecting - I noticed you run a [specific] company in [area]. I've been working with similar companies and noticed they all share the same 3 problems: missed calls after hours, slow follow-up on leads, and drowning in admin. Sound familiar? If even one of those hit home, I have a pretty elegant AI solution. No pitch - just a conversation.","char_count":367,"scores":{"reply_rate_potential":8,"authenticity":8,"value_signal":8,"curiosity":7,"brevity":8},"avg_score":7.8,"status":"keep","pattern":"abraham_diagnostic + buchan_conversational"}
{"run":1,"type":"first_dm","audience":"marketing_agency","variation":1,"message":"[Name] - thanks for connecting! Here's my unusual offer: I build AI systems for home services companies (think AI receptionists, automated follow-up, lead qualification). I need marketing agencies to refer clients to. In return, you get a partner who makes your client results look phenomenal AND a rev share. I know it sounds too good - happy to explain the model on a quick call.","char_count":376,"scores":{"reply_rate_potential":8,"authenticity":7,"value_signal":9,"curiosity":8,"brevity":8},"avg_score":8.0,"status":"keep","pattern":"abraham_partnership_value + rev_share"}
{"run":1,"type":"first_dm","audience":"marketing_agency","variation":2,"message":"Hey [Name], appreciate the connect! So here's why I reached out - your agency generates leads for clients, right? Here's the brutal truth: most of those leads die because the client takes 4+ hours to follow up. My AI follows up in under 60 seconds. Imagine telling your clients their lead-to-appointment rate just doubled. That's the pitch to YOU, not your clients. Interested?","char_count":379,"scores":{"reply_rate_potential":9,"authenticity":8,"value_signal":9,"curiosity":8,"brevity":8},"avg_score":8.4,"status":"keep","pattern":"abraham_reframe + buchan_honest_pitch"}
{"run":1,"type":"first_dm","audience":"marketing_agency","variation":3,"message":"[Name]! So glad we connected. Quick context: I run an AI automation agency focused on home services. Here's why that matters to YOU - your clients are probably wasting 30-50% of the leads you generate for them because their follow-up is too slow. My AI fixes that in 48 hours. Net result: your agency looks like wizards, clients stay longer, everyone wins. Want the full picture?","char_count":386,"scores":{"reply_rate_potential":8,"authenticity":7,"value_signal":9,"curiosity":7,"brevity":8},"avg_score":7.8,"status":"keep","pattern":"abraham_everyone_wins + specific_problem"}
{"run":1,"type":"first_dm","audience":"marketing_agency","variation":4,"message":"Thanks for connecting, [Name]! I have a weird business model I'd love your take on. I partner with marketing agencies and add an AI layer to their client delivery - instant lead follow-up, appointment booking, missed call recovery. The agency gets better results, happier clients, and I handle all the tech. You literally just introduce me. Is this interesting or am I dreaming?","char_count":375,"scores":{"reply_rate_potential":8,"authenticity":9,"value_signal":8,"curiosity":8,"brevity":8},"avg_score":8.2,"status":"keep","pattern":"buchan_vulnerability + abraham_leverage"}
{"run":1,"type":"first_dm","audience":"marketing_agency","variation":5,"message":"[Name] - real talk. I see a lot of agencies struggling to prove ROI to clients. What if you could show them that 95% of their leads now get contacted within 60 seconds? That's what my AI does. I'm looking for 3 agency partners this quarter. No cost to you - I work directly with your clients and you get the credit. Too good? Let me prove it.","char_count":348,"scores":{"reply_rate_potential":8,"authenticity":7,"value_signal":9,"curiosity":7,"brevity":8},"avg_score":7.8,"status":"keep","pattern":"abraham_proof + scarcity"}
{"run":1,"type":"first_dm","audience":"business_coaches","variation":1,"message":"[Name], thanks for connecting! Here's why I think we should actually talk: your coaching clients want more time and more revenue. My AI systems literally create both - automated follow-up, scheduling, lead response. What if you could recommend a solution to your clients that solves their #1 complaint (not enough time) AND makes your coaching results accelerate? I'd love to explore a referral partnership.","char_count":401,"scores":{"reply_rate_potential":7,"authenticity":7,"value_signal":8,"curiosity":7,"brevity":7},"avg_score":7.2,"status":"keep","pattern":"abraham_preeminence + referral_partnership"}
{"run":1,"type":"first_dm","audience":"business_coaches","variation":2,"message":"Hey [Name]! Glad we connected. Quick insight from my world: I build AI automation for SMBs, and I keep hearing the same thing - 'My coach told me to systematize but I don't know how.' That's where I come in. Would you be open to being the coach who can actually hand clients a done-for-them automation solution? I think there's a genuine partnership here.","char_count":360,"scores":{"reply_rate_potential":8,"authenticity":8,"value_signal":8,"curiosity":7,"brevity":8},"avg_score":7.8,"status":"keep","pattern":"abraham_cross_industry + buchan_genuine"}
{"run":1,"type":"first_dm","audience":"business_coaches","variation":3,"message":"[Name] - so here's a thought. Your clients hire you to grow their business. But growth creates chaos unless systems are in place, right? I automate the chaos part. AI that handles their calls, leads, scheduling, follow-up. Imagine being the coach who doesn't just teach strategy but hands them the infrastructure to execute it. Want to jam on this for 10 min?","char_count":368,"scores":{"reply_rate_potential":8,"authenticity":8,"value_signal":9,"curiosity":8,"brevity":8},"avg_score":8.2,"status":"keep","pattern":"abraham_strategic_thinking + execution_gap"}
{"run":1,"type":"first_dm","audience":"business_coaches","variation":4,"message":"Thanks for the connect, [Name]! I'll cut to it - I think business coaches are sitting on an untapped goldmine. Your clients trust you more than anyone. If you could recommend an AI system that saves them 10+ hours/week (and I can prove it does), that's a massive win for everyone. I'm building a referral program specifically for coaches. Interested in being one of the first?","char_count":381,"scores":{"reply_rate_potential":7,"authenticity":7,"value_signal":8,"curiosity":7,"brevity":8},"avg_score":7.4,"status":"keep","pattern":"abraham_leverage + scarcity"}
{"run":1,"type":"first_dm","audience":"business_coaches","variation":5,"message":"[Name]! So we connected and now the awkward 'what do we talk about' part. Here's my take: you coach SMB owners. I automate SMB operations with AI. Together, your clients get strategy AND execution in one package. I'm not trying to sell to your clients behind your back - I want to build something with you. Coffee chat this week?","char_count":339,"scores":{"reply_rate_potential":8,"authenticity":9,"value_signal":7,"curiosity":7,"brevity":8},"avg_score":7.8,"status":"keep","pattern":"buchan_self_aware_humor + abraham_partnership"}
{"run":1,"type":"follow_up_dm","audience":"home_services","variation":1,"message":"Hey [Name], no worries if my last message got buried - I know running a home services company means your inbox looks like a war zone. Just wanted to share this quick: one of my HVAC clients just told me the AI system I built him saved his first $10K in missed revenue last month alone. If that number interests you even slightly, I'm around. If not, no hard feelings at all.","char_count":377,"scores":{"reply_rate_potential":7,"authenticity":8,"value_signal":8,"curiosity":7,"brevity":8},"avg_score":7.6,"status":"keep","pattern":"buchan_empathy + abraham_proof"}
{"run":1,"type":"follow_up_dm","audience":"home_services","variation":2,"message":"[Name] - following up because I genuinely think you're leaving money on the table (and I hate seeing that). Quick stat: the average home services company misses 30-50% of inbound calls. At $500+ per job, that's $15K-$25K/month walking away. My AI catches every single one. If you've got 5 minutes this week, I'll show you exactly how it works. If the timing's off, just say so.","char_count":389,"scores":{"reply_rate_potential":8,"authenticity":7,"value_signal":9,"curiosity":7,"brevity":8},"avg_score":7.8,"status":"keep","pattern":"abraham_opportunity_cost + specific_numbers"}
{"run":1,"type":"follow_up_dm","audience":"home_services","variation":3,"message":"[Name], last nudge from me (promise). I just published a free breakdown showing how 3 home services companies are using AI to book 40% more jobs without hiring anyone. No opt-in, no funnel, just a Google Doc. Want the link? Either way, wishing you a killer quarter.","char_count":268,"scores":{"reply_rate_potential":8,"authenticity":9,"value_signal":8,"curiosity":8,"brevity":9},"avg_score":8.4,"status":"keep","pattern":"abraham_generosity + buchan_no_pressure + content_lead"}
{"run":1,"type":"follow_up_dm","audience":"home_services","variation":4,"message":"Hey [Name], circling back one more time. I noticed your company has great reviews - clearly you deliver. The question is: are you capturing every potential customer who tries to reach you? Most home services companies aren't, and it's costing them $10K-$30K/month. I built something that fixes that in 48 hours. Happy to show you, or happy to just be a connection. Your call.","char_count":387,"scores":{"reply_rate_potential":7,"authenticity":7,"value_signal":8,"curiosity":6,"brevity":8},"avg_score":7.2,"status":"keep","pattern":"personalization + abraham_opportunity_cost"}
{"run":1,"type":"follow_up_dm","audience":"home_services","variation":5,"message":"[Name], I'll keep this to 10 seconds of your time: AI receptionist. Answers every call. Books every job. Costs less than a part-time hire. 3-day setup. I have a demo with your company name on it if you want to see it in action. If not, I'll stop bugging you. Deal?","char_count":267,"scores":{"reply_rate_potential":7,"authenticity":7,"value_signal":9,"curiosity":6,"brevity":9},"avg_score":7.6,"status":"keep","pattern":"brevity_focus + buchan_deal_closer"}
{"run":1,"type":"follow_up_dm","audience":"marketing_agency","variation":1,"message":"[Name], circling back on my AI partnership idea. Here's something that might change your mind: I just helped an agency add $4K/month in recurring revenue by white-labeling my AI lead follow-up system to their clients. Zero extra work for them. I know you're busy - but is 'extra recurring revenue with no extra work' something worth 10 minutes to explore?","char_count":363,"scores":{"reply_rate_potential":8,"authenticity":7,"value_signal":9,"curiosity":8,"brevity":8},"avg_score":8.0,"status":"keep","pattern":"abraham_proof + revenue_model"}
{"run":1,"type":"follow_up_dm","audience":"marketing_agency","variation":2,"message":"Hey [Name], quick follow-up. I realized I buried the lead last time. Here's the simple version: I build AI that makes your clients' leads convert faster. You introduce me. I do all the work. You get rev share. Your clients love you more. I'm already doing this with 2 agencies and it's working stupidly well. Want in?","char_count":323,"scores":{"reply_rate_potential":8,"authenticity":8,"value_signal":9,"curiosity":7,"brevity":9},"avg_score":8.2,"status":"keep","pattern":"buchan_self_aware + abraham_simple_model"}
{"run":1,"type":"follow_up_dm","audience":"marketing_agency","variation":3,"message":"[Name] - last attempt, I promise. Here's the elevator pitch: your agency generates leads. My AI converts them 3x faster. Together, your clients get insane ROI and you look like a genius. I handle setup, support, everything. You just make the intro. If this sounds interesting, reply with literally anything and I'll send details. If not, I respect that.","char_count":354,"scores":{"reply_rate_potential":7,"authenticity":7,"value_signal":8,"curiosity":6,"brevity":8},"avg_score":7.2,"status":"keep","pattern":"abraham_mutual_value + low_friction_cta"}
