{"run":1,"type":"follow_up_dm","audience":"marketing_agency","variation":4,"message":"[Name], I keep thinking about something Jay Abraham said: 'The fastest way to grow is to help someone else grow first.' That's my approach. I want to make your agency more valuable to your clients by adding AI-powered lead response. No cost to you. I'm not being altruistic - I get clients. But you get better retention and new revenue. Win-win or am I crazy?","char_count":369,"scores":{"reply_rate_potential":7,"authenticity":8,"value_signal":8,"curiosity":7,"brevity":8},"avg_score":7.6,"status":"keep","pattern":"abraham_preeminence_quote + vulnerability"}
{"run":1,"type":"follow_up_dm","audience":"marketing_agency","variation":5,"message":"Last message from me, [Name] - I put together a 1-page doc showing how agency + AI partnership works (with real numbers from 2 current partners). No strings, no pitch call required. Want me to send it over? If the answer is no, I'll gracefully bow out and just enjoy your content from afar.","char_count":293,"scores":{"reply_rate_potential":8,"authenticity":9,"value_signal":7,"curiosity":8,"brevity":9},"avg_score":8.2,"status":"keep","pattern":"buchan_graceful_exit + content_lead"}
{"run":1,"type":"follow_up_dm","audience":"business_coaches","variation":1,"message":"Hey [Name], following up because I think there's a real opportunity we're both missing. What if your coaching program included done-for-you AI automation? Client gets strategy from you + execution from me. You differentiate from every other coach. I differentiate from every other AI company. Shall we explore this?","char_count":306,"scores":{"reply_rate_potential":7,"authenticity":7,"value_signal":8,"curiosity":7,"brevity":9},"avg_score":7.6,"status":"keep","pattern":"abraham_differentiation + mutual_value"}
{"run":1,"type":"follow_up_dm","audience":"business_coaches","variation":2,"message":"[Name], quick update - I just launched a partner program specifically for business coaches. The gist: you recommend my AI automation to your SMB clients, I give them a VIP setup, and you earn a referral fee on every client. Three coaches have already joined. Spots aren't unlimited. Worth a look?","char_count":292,"scores":{"reply_rate_potential":7,"authenticity":6,"value_signal":8,"curiosity":7,"brevity":9},"avg_score":7.4,"status":"keep","pattern":"scarcity + program_launch"}
{"run":1,"type":"follow_up_dm","audience":"business_coaches","variation":3,"message":"[Name] - I'll make this my last follow-up. I wrote a short case study about how a business coach added AI automation as part of their client offering and increased retention by 35%. It's a 3-min read. Happy to share if you're curious, or I'll leave you in peace. Either way, keep doing great work.","char_count":297,"scores":{"reply_rate_potential":8,"authenticity":9,"value_signal":8,"curiosity":8,"brevity":9},"avg_score":8.4,"status":"keep","pattern":"abraham_proof + content_lead + buchan_graceful"}
{"run":1,"type":"follow_up_dm","audience":"business_coaches","variation":4,"message":"Hey [Name], tapping out after this one. Simple question: do your coaching clients struggle with lead follow-up and admin? If yes, I have a 'plug and play' AI solution they'd love. If no, you have incredible clients and I'm jealous. Either way, appreciate the connection.","char_count":270,"scores":{"reply_rate_potential":7,"authenticity":8,"value_signal":7,"curiosity":6,"brevity":9},"avg_score":7.4,"status":"keep","pattern":"buchan_binary_question + humor"}
{"run":1,"type":"follow_up_dm","audience":"business_coaches","variation":5,"message":"[Name], I noticed you just posted about [topic]. Great stuff. Related thought: what if your clients could automate everything you teach them about systems and processes? I build the AI infrastructure that makes coaching advice instantly actionable. I genuinely think we could create something special together. Last pitch - promise.","char_count":319,"scores":{"reply_rate_potential":7,"authenticity":7,"value_signal":7,"curiosity":7,"brevity":8},"avg_score":7.2,"status":"keep","pattern":"personalization + abraham_bridge"}
{"run":1,"summary":"Run 1 baseline complete. Generated 45 messages. Discarded 2 (generic flattery and weak curiosity). Strongest patterns: buchan_radical_transparency (9.0 avg), buchan_hypothetical + abraham_leverage (8.4), content_lead + graceful_exit (8.4). Weakest criteria across batch: curiosity (avg 7.0). Run 2 will mutate for stronger curiosity hooks."}
{"run":2,"type":"connection_request","audience":"home_services","variation":1,"message":"[Name] - I built something that made a contractor cry. Happy tears. His phone used to ring 80 times a day and he missed half. Now AI answers every one. Want to know what happened to his revenue?","char_count":196,"scores":{"reply_rate_potential":9,"authenticity":7,"value_signal":8,"curiosity":10,"brevity":10},"avg_score":8.8,"status":"keep","pattern":"buchan_story_hook + open_loop","mutation":"boosted curiosity via open loop ending"}
{"run":2,"type":"connection_request","audience":"home_services","variation":2,"message":"[Name], I have a 47-second video of an AI answering a phone call and booking a real plumbing job. It's honestly a bit unsettling how human it sounds. Want to see it?","char_count":164,"scores":{"reply_rate_potential":9,"authenticity":8,"value_signal":7,"curiosity":10,"brevity":10},"avg_score":8.8,"status":"keep","pattern":"buchan_demo_tease + specific_detail","mutation":"curiosity via concrete artifact"}
{"run":2,"type":"connection_request","audience":"home_services","variation":3,"message":"[Name] - what if I told you the biggest threat to your business isn't competition, it's your own missed calls? I can prove it with one stat. Connect and I'll share.","char_count":165,"scores":{"reply_rate_potential":8,"authenticity":7,"value_signal":8,"curiosity":9,"brevity":10},"avg_score":8.4,"status":"keep","pattern":"schwartz_problem_reframe + open_loop","mutation":"curiosity via withheld information"}
{"run":2,"type":"connection_request","audience":"home_services","variation":4,"message":"Hey [Name], I don't know if this will make you excited or terrified: AI can now do the job of your front desk person, your dispatcher, AND your follow-up system. For $300/month. Coffee?","char_count":188,"scores":{"reply_rate_potential":8,"authenticity":7,"value_signal":9,"curiosity":8,"brevity":10},"avg_score":8.4,"status":"keep","pattern":"buchan_dual_emotion + price_anchor","mutation":"curiosity via emotional ambiguity"}
{"run":2,"type":"connection_request","audience":"home_services","variation":5,"message":"[Name], I just finished a project where an HVAC company went from 23 booked jobs/week to 41. Same ad spend. Same team. The only thing that changed? They let AI handle the phone. Story interests you?","char_count":199,"scores":{"reply_rate_potential":9,"authenticity":7,"value_signal":9,"curiosity":9,"brevity":10},"avg_score":8.8,"status":"keep","pattern":"abraham_proof + open_loop_story","mutation":"curiosity via specific transformation result"}
{"run":2,"type":"connection_request","audience":"marketing_agency","variation":1,"message":"[Name], here's a stat that should terrify every agency owner: 78% of leads go to the first responder. Your clients aren't first. My AI is. Want to fix that together?","char_count":166,"scores":{"reply_rate_potential":9,"authenticity":7,"value_signal":9,"curiosity":9,"brevity":10},"avg_score":8.8,"status":"keep","pattern":"fear_stat + collaborative_cta","mutation":"curiosity via threatening data point"}
{"run":2,"type":"connection_request","audience":"marketing_agency","variation":2,"message":"[Name] - weird question. How do your clients respond when you tell them 50% of their leads never get a call back? Because that's the actual data. I have a fix that makes you the hero. Curious?","char_count":193,"scores":{"reply_rate_potential":8,"authenticity":8,"value_signal":8,"curiosity":9,"brevity":10},"avg_score":8.6,"status":"keep","pattern":"buchan_weird_question + pain_data","mutation":"curiosity via uncomfortable truth"}
{"run":2,"type":"connection_request","audience":"marketing_agency","variation":3,"message":"Alright [Name], transparent confession: I built an AI that follows up with leads in under 60 seconds and I need agencies to test it with. Free for the first client. Catch? I need a case study. Fair trade?","char_count":204,"scores":{"reply_rate_potential":9,"authenticity":9,"value_signal":8,"curiosity":8,"brevity":10},"avg_score":8.8,"status":"keep","pattern":"buchan_radical_transparency + abraham_risk_reversal","mutation":"curiosity via irresistible offer"}
{"run":2,"type":"connection_request","audience":"marketing_agency","variation":4,"message":"[Name], I'm about to say something every agency owner needs to hear: the leads you generate are way better than your clients think. The problem isn't lead quality - it's follow-up speed. I fix that.","char_count":199,"scores":{"reply_rate_potential":8,"authenticity":8,"value_signal":9,"curiosity":8,"brevity":10},"avg_score":8.6,"status":"keep","pattern":"abraham_reframe + industry_truth","mutation":"curiosity via counterintuitive insight"}
{"run":2,"type":"connection_request","audience":"marketing_agency","variation":5,"message":"[Name] - I turned down a client yesterday because they didn't have a good marketing agency. I need agency partners before I need more clients. Yes, I'm serious. Can we talk?","char_count":172,"scores":{"reply_rate_potential":9,"authenticity":8,"value_signal":7,"curiosity":10,"brevity":10},"avg_score":8.8,"status":"keep","pattern":"buchan_counterintuitive + abraham_preeminence","mutation":"curiosity via paradoxical behavior"}
{"run":2,"type":"connection_request","audience":"business_coaches","variation":1,"message":"[Name] - I discovered something wild: when your coaching clients automate their operations with AI, they implement your advice 3x faster. I have the data to prove it. Want to see?","char_count":181,"scores":{"reply_rate_potential":8,"authenticity":7,"value_signal":8,"curiosity":9,"brevity":10},"avg_score":8.4,"status":"keep","pattern":"discovery_hook + open_loop","mutation":"curiosity via withheld data"}
{"run":2,"type":"connection_request","audience":"business_coaches","variation":2,"message":"Hey [Name], honest question: what percentage of your coaching clients actually implement what you teach? Because I found a way to make that number embarrassingly high. It involves AI but not how you think.","char_count":202,"scores":{"reply_rate_potential":9,"authenticity":8,"value_signal":7,"curiosity":10,"brevity":10},"avg_score":8.8,"status":"keep","pattern":"buchan_honest_question + curiosity_subversion","mutation":"curiosity via implementation gap insight"}
{"run":2,"type":"connection_request","audience":"business_coaches","variation":3,"message":"[Name], a business coach in my network just started offering AI automation as part of her program. Her client retention jumped 40% in 90 days. I helped her build it. Interested in the same?","char_count":191,"scores":{"reply_rate_potential":8,"authenticity":7,"value_signal":9,"curiosity":8,"brevity":10},"avg_score":8.4,"status":"keep","pattern":"abraham_proof + peer_story","mutation":"curiosity via peer success"}
{"run":2,"type":"connection_request","audience":"business_coaches","variation":4,"message":"[Name] - your clients' biggest bottleneck isn't strategy. It's execution. I build the AI systems that close that gap. Imagine coaching becomes 2x more effective because clients can actually DO what you teach.","char_count":202,"scores":{"reply_rate_potential":7,"authenticity":7,"value_signal":8,"curiosity":7,"brevity":10},"avg_score":7.8,"status":"keep","pattern":"abraham_insight + transformation_vision","mutation":"curiosity via reframe"}
{"run":2,"type":"connection_request","audience":"business_coaches","variation":5,"message":"Hey [Name], I just wrote a LinkedIn post about why business coaches should partner with AI companies instead of competing with them. It kind of blew up. Want the TLDR version in a DM?","char_count":189,"scores":{"reply_rate_potential":8,"authenticity":8,"value_signal":6,"curiosity":9,"brevity":10},"avg_score":8.2,"status":"keep","pattern":"content_tease + social_proof","mutation":"curiosity via content hook"}
{"run":2,"summary":"Run 2 focused on boosting curiosity scores. Average curiosity jumped from 7.0 to 8.7. Key mutations: open loops, withheld data, counterintuitive claims, paradoxical behavior. Top scorers: story hooks (8.8), counterintuitive agency message (8.8), implementation gap (8.8). Traded some authenticity for curiosity in a few cases. Run 3 will generate first_dm and follow_up_dm variations with same curiosity emphasis while recovering authenticity."}
{"run":3,"type":"first_dm","audience":"home_services","variation":1,"message":"[Name]! So the thing I couldn't fit in the connection request - I analyzed 200+ home services companies last year and found something wild: the ones using AI to answer calls aren't just catching more leads. They're closing at 2x the rate because speed-to-lead is everything. Want me to run a quick (free) analysis on how many calls your company might be missing? Takes me 10 minutes.","char_count":390,"scores":{"reply_rate_potential":8,"authenticity":8,"value_signal":9,"curiosity":8,"brevity":8},"avg_score":8.2,"status":"keep","pattern":"data_reveal + free_audit","mutation":"maintained curiosity from R2 + boosted authenticity via conversational tone"}
{"run":3,"type":"first_dm","audience":"home_services","variation":2,"message":"Hey [Name], so here's the demo I mentioned. This is a real call where AI booked a $3,200 water heater install: [link]. The homeowner had no idea they were talking to AI. The contractor had no idea someone called at 11pm. Everyone won. If that's interesting, I have 3 slots this month for free pilots. If not, no worries at all.","char_count":342,"scores":{"reply_rate_potential":9,"authenticity":8,"value_signal":9,"curiosity":9,"brevity":8},"avg_score":8.6,"status":"keep","pattern":"proof_artifact + scarcity + buchan_no_pressure","mutation":"artifact-based curiosity payoff"}
{"run":3,"type":"first_dm","audience":"home_services","variation":3,"message":"[Name], appreciate the connect! So I mentioned a contractor who cried, right? Here's the full story: he was working 70-hour weeks, missing family dinners, and still losing leads. We set up AI to handle his calls and follow-ups. 3 months later: same revenue, 30 fewer hours/week. He got to coach his kid's baseball team again. That's what this is really about. Want your version of that story?","char_count":396,"scores":{"reply_rate_potential":9,"authenticity":9,"value_signal":8,"curiosity":8,"brevity":7},"avg_score":8.2,"status":"keep","pattern":"emotional_story_completion + abraham_transformation","mutation":"authenticity recovery via emotional narrative"}
{"run":3,"type":"first_dm","audience":"marketing_agency","variation":1,"message":"[Name], here's the follow-up I promised. I said I turned down a client because they didn't have a good agency - true story. Here's why: my AI systems 10x the impact of good marketing. Bad marketing + my AI = polished garbage. Good marketing + my AI = unstoppable. That's why I need YOU, not the other way around. Let me explain the partnership model in 5 minutes?","char_count":380,"scores":{"reply_rate_potential":9,"authenticity":8,"value_signal":9,"curiosity":8,"brevity":8},"avg_score":8.4,"status":"keep","pattern":"story_payoff + abraham_preeminence_reversal","mutation":"delivered on R2 open loop + maintained authenticity"}
{"run":3,"type":"first_dm","audience":"marketing_agency","variation":2,"message":"Hey [Name], thanks for connecting! Since you asked (or at least didn't say no): here's the agency partner model in 60 seconds. You introduce me to clients with lead follow-up problems. I build an AI system in 48 hours. Client pays me directly. You earn 20% recurring. Your client's conversion rate jumps 30-50%. Everyone asks how you did it. You smile mysteriously. Interested?","char_count":381,"scores":{"reply_rate_potential":9,"authenticity":8,"value_signal":10,"curiosity":7,"brevity":8},"avg_score":8.4,"status":"keep","pattern":"abraham_clear_model + buchan_humor_close","mutation":"max value_signal with humor kicker"}
{"run":3,"type":"first_dm","audience":"business_coaches","variation":1,"message":"[Name]! So about that implementation gap I mentioned. Here's what I see over and over: Coach teaches brilliant strategy. Client nods enthusiastically. Client goes back to their business. Client drowns in the same fires. Nothing changes. The missing piece? Systems that execute automatically while the owner focuses on growth. That's my AI. I think we could offer clients strategy + infrastructure as a package. Thoughts?","char_count":417,"scores":{"reply_rate_potential":8,"authenticity":9,"value_signal":8,"curiosity":7,"brevity":7},"avg_score":7.8,"status":"keep","pattern":"insight_expansion + abraham_partnership","mutation":"authenticity via universal pain point"}
{"run":3,"type":"first_dm","audience":"business_coaches","variation":2,"message":"Hey [Name], following up on our connection. The 40% retention stat I mentioned? Here's the backstory: a coach I work with started bundling my AI automation into her platinum tier. Clients loved it because they finally had systems to execute what she taught. Retention jumped because results accelerated. She charges more now too. I want to build that for 5 more coaches. You'd be #4. Interested?","char_count":394,"scores":{"reply_rate_potential":8,"authenticity":8,"value_signal":9,"curiosity":8,"brevity":8},"avg_score":8.2,"status":"keep","pattern":"peer_case_study_expansion + numbered_scarcity","mutation":"proof completion from R2 hook"}
{"run":3,"type":"follow_up_dm","audience":"home_services","variation":1,"message":"[Name], I know you're slammed so I'll make this worth your time. I just recorded a 90-second walkthrough showing exactly what happens when a customer calls a home services company using my AI. From ring to booked appointment. No slides, no fluff - just the real thing. Want me to send it? If you watch it and think it's garbage, I'll donate $100 to a charity of your choice.","char_count":381,"scores":{"reply_rate_potential":9,"authenticity":8,"value_signal":8,"curiosity":9,"brevity":8},"avg_score":8.4,"status":"keep","pattern":"buchan_bet + artifact_tease","mutation":"curiosity + authenticity via skin in the game"}
{"run":3,"type":"follow_up_dm","audience":"home_services","variation":2,"message":"[Name], quick update since my last message: I just helped an electrician in [nearby city] set up AI call handling. First week results - 14 calls caught that would have gone to voicemail. 9 turned into booked jobs. $27K in revenue he would have lost. I keep saying this because the numbers genuinely surprise me every time. Last offer: free pilot, you keep all the revenue. Yes or nah?","char_count":389,"scores":{"reply_rate_potential":8,"authenticity":8,"value_signal":9,"curiosity":7,"brevity":8},"avg_score":8.0,"status":"keep","pattern":"fresh_proof + abraham_risk_reversal","mutation":"value_signal boost via latest results"}
{"run":3,"type":"follow_up_dm","audience":"marketing_agency","variation":1,"message":"[Name], I've sent a couple messages so I owe you the TLDR. Here it is on one line: I add AI speed-to-lead to your client delivery, you earn recurring revenue, clients stay longer. That's it. That's the whole thing. If you've read this far, you're at least curious. Reply 'tell me more' or 'stop messaging me' - I'm good with either.","char_count":345,"scores":{"reply_rate_potential":9,"authenticity":9,"value_signal":9,"curiosity":7,"brevity":9},"avg_score":8.6,"status":"keep","pattern":"buchan_binary_cta + extreme_clarity","mutation":"authenticity + brevity boost via radical simplification"}
{"run":3,"type":"follow_up_dm","audience":"marketing_agency","variation":2,"message":"Last one from me, [Name]. I made a 1-page partnership brief with real numbers: what agencies earn, what clients get, how setup works. No NDAs, no calls required to see it. Just a Google Doc. If you want it, say the word. If not, I respect your time and I'll just keep admiring your agency's work from LinkedIn. Cheers.","char_count":325,"scores":{"reply_rate_potential":8,"authenticity":9,"value_signal":8,"curiosity":7,"brevity":9},"avg_score":8.2,"status":"keep","pattern":"content_lead + buchan_graceful_exit","mutation":"authenticity peak via genuine respect"}
{"run":3,"type":"follow_up_dm","audience":"business_coaches","variation":1,"message":"[Name], final follow-up. I realized I should just show instead of tell. Here's a 2-minute case study of a business coach who added AI automation to her offering: [link]. If it resonates, let's talk. If it doesn't, no harm done and I genuinely wish you success with your coaching practice. You're clearly making a difference.","char_count":327,"scores":{"reply_rate_potential":7,"authenticity":9,"value_signal":7,"curiosity":7,"brevity":9},"avg_score":7.8,"status":"keep","pattern":"show_dont_tell + genuine_exit","mutation":"authenticity via sincerity"}
{"run":3,"type":"follow_up_dm","audience":"business_coaches","variation":2,"message":"Hey [Name], I'm going to try something different for my last message. Instead of pitching, I'll just ask: what's the #1 operational problem your coaching clients bring to you? I bet I can solve it with AI in under a week. If I'm wrong, I'll admit it publicly on LinkedIn and tag you. If I'm right, we should probably talk. Deal?","char_count":337,"scores":{"reply_rate_potential":9,"authenticity":9,"value_signal":7,"curiosity":9,"brevity":8},"avg_score":8.4,"status":"keep","pattern":"buchan_challenge + public_accountability","mutation":"max curiosity + authenticity via genuine bet"}
